MishearID,Src,Tgt,Tips,Note,OriginalFlag,DocID,URL,SpeakerID,ListenerID,Language,Tags,Envs
www_1101_com_m_iimatugai_2811_html_001,種田山頭火の記念碑,亀田三兄弟の記念碑,しっかり画面を見て確認しよう。,テレビをつけっぱなしで作業中、音だけ聞いていたため、似た音の有名人名に聞き間違えた。,True,www_1101_com_m_iimatugai_2811_html,N/A,TV,投稿者,日本語,"['聞き間違い', 'テレビ', '有名人', '日常', 'ユーモア']","['家', 'テレビ', '作業中']"
www_1101_com_m_iimatugai_2811_html_002,ゲータレード,経団連,カタカナ語と日本語の聞き間違いに注意。,友人との会話で、飲み物名「ゲータレード」を「経団連」と聞き間違えた。文脈で違和感に気づく。,True,www_1101_com_m_iimatugai_2811_html,N/A,友人,投稿者,日本語,"['聞き間違い', '会話', 'カタカナ語', 'ユーモア']","['会話', '友人同士']"
www_1101_com_m_iimatugai_2811_html_003,体操着持ってきた？,ハリソンフォード来た？,文脈で判断しよう。,学生時代、友人が「体操着持ってきた？」と聞いたのを「ハリソンフォード来た？」と聞き間違えた。,True,www_1101_com_m_iimatugai_2811_html,N/A,友人,投稿者,日本語,"['聞き間違い', '学生', '会話', '有名人', 'ユーモア']","['学校', '休み時間', '会話']"
www_1101_com_m_iimatugai_2811_html_004,モツ鍋屋なんですけど,宇都宮なんですけど,地名や料理名の聞き間違いに注意。,会社の同僚との会話で、栃木出身の後輩が「モツ鍋屋」と言ったのを「宇都宮」と聞き間違えた。,True,www_1101_com_m_iimatugai_2811_html,N/A,後輩,同僚,日本語,"['聞き間違い', '会社', '会話', '地名', '料理', 'ユーモア']","['会社', '会話', '打ち上げ場所検討']"
www_1101_com_m_iimatugai_2811_html_005,日系ブラジル人,一見ブラジル人,ニュースの聞き取りは注意深く。,ニュースを聞いていた母が「日系ブラジル人」を「一見ブラジル人」と聞き間違えた。,True,www_1101_com_m_iimatugai_2811_html,N/A,アナウンサー,母,日本語,"['聞き間違い', 'ニュース', '家族', 'ユーモア']","['家', 'テレビ', 'ニュース']"
www_1101_com_m_iimatugai_2811_html_006,取手ゆき、発車します,鳥居みゆき、発射します,アナウンスはしっかり聞こう。,駅のアナウンス「取手ゆき、発車します」を「鳥居みゆき、発射します」と聞き間違えた。,True,www_1101_com_m_iimatugai_2811_html,N/A,アナウンス,投稿者,日本語,"['聞き間違い', '駅', 'アナウンス', '有名人', 'ユーモア']","['駅', 'アナウンス', '移動中']"
www_1101_com_m_iimatugai_2811_html_007,（柚子胡椒を）溶いておきましょう,トイレ行ってきます,料理番組は画面も確認しよう。,料理番組を音だけ聞いていて「溶いておきましょう」を「トイレ行ってきます」と聞き間違えた。,True,www_1101_com_m_iimatugai_2811_html,N/A,先生,投稿者,日本語,"['聞き間違い', '料理', 'テレビ', 'ユーモア']","['家', 'テレビ', 'パソコン作業中']"
www_1101_com_m_iimatugai_2811_html_008,手すりにつかまり,ボツリヌス菌,アナウンスは注意深く聞こう。,駅のエスカレーターのアナウンス「手すりにつかまり」を「ボツリヌス菌」と聞き間違えた。,True,www_1101_com_m_iimatugai_2811_html,N/A,アナウンス,投稿者,日本語,"['聞き間違い', '駅', 'アナウンス', 'ユーモア']","['駅', 'エスカレーター', 'アナウンス']"
