MishearID,Src,Tgt,Tips,Note,OriginalFlag,DocID,URL,SpeakerID,ListenerID,Language
www_1101_com_iimatugai_2010-12-07_html_001,レンズ半額セール,ベンツ半額セール,店頭の呼び込みははっきり聞こう,街中を歩いていて後ろから聞こえた声を聞き間違い。メガネ屋のセールの呼び込み。,True,www_1101_com_iimatugai_2010-12-07_html,,不明,ふぃん,ja
www_1101_com_iimatugai_2010-12-07_html_002,押しボタン信号,お仕事安心号,交通用語は聞き慣れないと間違えやすい,友人と横断歩道に近づいた時、友人の発言を聞き間違い。,True,www_1101_com_iimatugai_2010-12-07_html,,友人,ぽち,ja
www_1101_com_iimatugai_2010-12-07_html_003,日本補助犬協会,日本お受験協会,募金の呼びかけは注意して聞こう,駅前での募金呼びかけを意識が低い状態で聞き間違い。内容も「お受験」関連に聞こえた。,True,www_1101_com_iimatugai_2010-12-07_html,,募金呼びかけ,名犬ぽち,ja
www_1101_com_iimatugai_2010-12-07_html_004,生暖かいね,ナマズがでかいね,家庭内の会話は文脈で判断しよう,母親の発言を子が聞き間違い。家庭内での会話。,True,www_1101_com_iimatugai_2010-12-07_html,,母,とろろ,ja
www_1101_com_iimatugai_2010-12-07_html_005,不審物,婦人靴,アナウンスは注意深く聞こう,駅ホームのアナウンスをぼんやり聞いていて「婦人靴」と聞き間違い。,True,www_1101_com_iimatugai_2010-12-07_html,,アナウンス,不明,ja
www_1101_com_iimatugai_2010-12-07_html_006,アーチ橋のつくり,ああ千葉市のつくり,子どもの音読は確認しよう,子どもの宿題の音読タイトルを親が聞き間違い。国語の教科書の内容。,True,www_1101_com_iimatugai_2010-12-07_html,,息子,不明,ja
www_1101_com_iimatugai_2010-12-07_html_007,歓喜のチェッカーフラッグ,肝機能チェック,テレビの音声は環境音に注意,テレビのアナウンサーの絶叫と車の排気音・歓声が重なり、健康番組と勘違い。,True,www_1101_com_iimatugai_2010-12-07_html,,アナウンサー,すーぱーＧＴ,ja
