MishearID,Src,Tgt,Tips,Note,OriginalFlag,DocID,URL,SpeakerID,ListenerID,Language,Tags,Envs
www_1101_com_m_iimatugai_2692_html_001,伊達公子 優勝！,バケツ２個,新聞の見出しは注意深く読もう,夫が新聞を見ながら「バケツ２個、すごいなー！」と発言。妻が聞き返すと「伊達公子 優勝！」の見出しだった。高齢で耳が遠くなっている。,True,www_1101_com_m_iimatugai_2692_html,N/A,夫,妻,日本語,"['聞き間違い', '家族', '新聞', '日常']","['家庭', '新聞', '静かな室内']"
www_1101_com_m_iimatugai_2692_html_002,大洗水族館,お笑い水族館,電話越しは特に発音に注意,後輩が電話で「お笑い水族館」と聞き間違えた。実際は「大洗水族館」からの電話だった。電話越しで聞き取りにくかった。,True,www_1101_com_m_iimatugai_2692_html,N/A,電話主,後輩,日本語,"['聞き間違い', '電話', '職場', '水族館']","['職場', '電話', 'オフィスノイズ']"
www_1101_com_m_iimatugai_2692_html_003,外れにくいナット,食べにくい納豆,ラジオは雑音や発音で誤解しやすい,運転中にラジオから「食べにくい納豆を開発しました」と聞こえたが、実際は「外れにくいナット」だった。車内でラジオを聴取。,True,www_1101_com_m_iimatugai_2692_html,N/A,ラジオ,運転者,日本語,"['聞き間違い', 'ラジオ', '車', '日常']","['車内', 'ラジオ', '走行音']"
www_1101_com_m_iimatugai_2692_html_004,和田アキ子,和太鼓,アーティスト名ははっきり確認しよう,CDショップで「和太鼓のCD」と聞き間違えたが、実際は「和田アキ子」のCDを探していた。店内の騒音も影響。,True,www_1101_com_m_iimatugai_2692_html,N/A,客,店員,日本語,"['聞き間違い', '店舗', '音楽', '日本語']","['店舗', 'CDショップ', '店内BGM']"
www_1101_com_m_iimatugai_2692_html_005,おかわり,お、かわいい,食事中の会話は文脈で判断しよう,レストランで上司が「おかわり」と言ったのを「お、かわいい」と聞き間違えた。ライスおかわり自由の店。,True,www_1101_com_m_iimatugai_2692_html,N/A,上司,部下,日本語,"['聞き間違い', '職場', '食事', '日常']","['レストラン', '食事中', '周囲の話し声']"
www_1101_com_m_iimatugai_2692_html_006,アルファベットの大文字で,ヴァイオレット大森,先入観で聞き間違えないよう注意,電話で住所を聞く際、「アルファベットの大文字で…」をマンション名と勘違いし「ヴァイオレット大森」と復唱してしまった。,True,www_1101_com_m_iimatugai_2692_html,N/A,顧客,受付担当,日本語,"['聞き間違い', '電話', '住所', '職場']","['職場', '電話', 'オフィスノイズ']"
www_1101_com_m_iimatugai_2692_html_007,来賓のお話しです,外人のお話しです,式典のアナウンスはよく聞こう,小学校の卒業式予行で「来賓のお話しです」を「外人のお話しです」と聞き間違え、当日まで外国人が来ると期待していた。,True,www_1101_com_m_iimatugai_2692_html,N/A,教員,生徒,日本語,"['聞き間違い', '学校', '式典', '日常']","['学校', '体育館', '式典', 'マイク音声']"
