MishearID,Src,Tgt,Tips,Note,OriginalFlag,DocID,URL,SpeakerID,ListenerID,Language
www1101com_iimatugai_archive_more060807_001,セクハラ問題,桜田門外,歴史用語と現代用語の音の類似に注意。,職場で同僚たちが「セクハラ問題」の話をしていたが、地図を見ていた投稿者は「桜田門外」と聞き間違えた。,True,www1101com_iimatugai_archive_more060807,,不明,ひら,ja
www1101com_iimatugai_archive_more060807_002,いいかしら？,江頭,早口や発音の不明瞭さに注意。,保健の先生が「いいかしら？」と言ったのを生徒たちが「江頭」と聞き間違えた。身体測定の場面。,True,www1101com_iimatugai_archive_more060807,,保健の先生,"ミケ, 友人",ja
www1101com_iimatugai_archive_more060807_003,数パーセント,スーパー銭湯,カタカナ語と和製英語の音の近さに注意。,朝礼で部長が「数パーセント」と言っていたのを「スーパー銭湯」と聞き間違えた。営業成績の話題。,True,www1101com_iimatugai_archive_more060807,,部長,Kato,ja
www1101com_iimatugai_archive_more060807_004,陸上部,肉が丈夫,子どもは語感で意味を取りがち。,母親が「陸上部で走ってた」と言ったのを5歳の息子が「肉が丈夫だったの？」と聞き間違えた。,True,www1101com_iimatugai_archive_more060807,,母親,息子,ja
www1101com_iimatugai_archive_more060807_005,つつじ,羊,植物名と動物名の音の類似に注意。,ニュースのお天気コーナーで「つつじの植え込み」を「羊の植え込み」と聞き間違えた。,True,www1101com_iimatugai_archive_more060807,,お天気キャスター,春ですから,ja
www1101com_iimatugai_archive_more060807_006,乾いてないね,かわいくないね,口の動きや文脈で誤解しやすい。,恋人が「今日はあんまり乾いてないね」と言ったのを「今日はあんまりかわいくないね」と聞き間違え、ショックを受けた。,True,www1101com_iimatugai_archive_more060807,,彼,36歳ですが,ja
www1101com_iimatugai_archive_more060807_007,除草,女装,同音異義語やイントネーションに注意。,テレビCMのナレーション「除草で一番大切なこと」を「女装で一番大切なこと」と聞き間違えた。,True,www1101com_iimatugai_archive_more060807,,CMナレーター,りえ,ja
www1101com_iimatugai_archive_more060807_008,荒唐無稽,高校生向き,難しい言葉は聞き慣れないと誤解しやすい。,映画の感想で「荒唐無稽」と言ったら、後輩が「高校生向き？」と聞き間違えた。,True,www1101com_iimatugai_archive_more060807,,先輩,後輩,ja
