MishearID,Src,Tgt,Tips,Note,OriginalFlag,DocID,URL,SpeakerID,ListenerID,Language
www_1101_com_iimatugai_2010-01-06_html_001,ななふんさんじゅうびょう,ノムヒョン大統領,数字の連続音は固有名詞に聞こえやすい,中学生の友人同士の会話。数字の「ななふんさんじゅうびょう（7分30秒）」が韓国の大統領名「ノムヒョン大統領」に聞こえた。音のリズムが似ているため。,True,www_1101_com_iimatugai_2010-01-06_html,,友人A,友人B,ja
www_1101_com_iimatugai_2010-01-06_html_002,最高33度,サインコサインタンジェント,数字の「さんじゅうさんど」と数式用語の音が似ている,夫婦の会話。夫が天気予報の「最高33度」と言ったのを、妻が「サインコサインタンジェント」と聞き間違えた。数学が苦手な妻が忙しい中で聞いたため。,True,www_1101_com_iimatugai_2010-01-06_html,,夫,妻,ja
www_1101_com_iimatugai_2010-01-06_html_003,レミオロメン,ネギラーメン,バンド名と食べ物名の音が似ている,家族の食卓で弟が「レミオロメン」と言ったのを父が「ネギラーメン」と聞き間違えた。以後、家族の中でネギラーメンを見るとレミオロメンを思い出すようになった。,True,www_1101_com_iimatugai_2010-01-06_html,,弟,父,ja
www_1101_com_iimatugai_2010-01-06_html_004,マリメッコ,森光子,外来語と日本人名の音が似ている,職場で同僚が「マリメッコのデザイン」と話していたら、部長が「森光子？」と聞き返した。部長は書類を探していて注意が散漫だった。,True,www_1101_com_iimatugai_2010-01-06_html,,同僚,部長,ja
www_1101_com_iimatugai_2010-01-06_html_005,みりんと,ミジンコ,料理用語と生物名の音が似ている,会社の同僚との会話。ハンバーグの和風ソースの作り方を説明した際、「みりんと」を「ミジンコ」と聞き間違えられた。真顔で聞き返されたため驚いた。,True,www_1101_com_iimatugai_2010-01-06_html,,まーちゃん,同僚,ja
www_1101_com_iimatugai_2010-01-06_html_006,ハナミズキ,鼻水,花の名前と体の現象の音が似ている,ラジオ番組で「ハナミズキ（花）」を「鼻水」と聞き間違え、感想を送ったらそのまま読まれてしまった。花の名前を知らず、勉強しながら聞いていたため。,True,www_1101_com_iimatugai_2010-01-06_html,,ラジオDJ,べっち,ja
www_1101_com_iimatugai_2010-01-06_html_007,横尾忠則展に行く,旅行ただ乗り券に行く,展覧会名と旅行券の音が似ている,電話で兄に「横尾忠則展に行く」と伝えたら「旅行ただ乗り券」と聞き間違えられた。兄は展覧会名を知らず、電話越しで聞き間違えた。,True,www_1101_com_iimatugai_2010-01-06_html,,妹,兄,ja
