MishearID,Src,Tgt,Tips,Note,OriginalFlag,DocID,URL,SpeakerID,ListenerID,Language
www_1101_com_m_iimatugai_2923_html_001,ヤジに答えてる,ヤギに答えてる,「ジ」と「ギ」の聞き分けに注意。,娘が国会中継を見て「ヤジに答えてる」と言ったのを母が「ヤギに答えてる」と聞き間違えた。家庭内、テレビ音声。,True,www_1101_com_m_iimatugai_2923_html,,daughter,mother,ja
www_1101_com_m_iimatugai_2923_html_002,革ひものネックレス,乾きものネックレス,アナウンスは聞き取りにくいことが多い。,ショッピングモールのアナウンス「革ひものネックレス」を「乾きものネックレス」と夫婦で聞き間違えた。,True,www_1101_com_m_iimatugai_2923_html,,announcer,couple,ja
www_1101_com_m_iimatugai_2923_html_003,線名ボタンに触れてください,せんべい布団に触れてください,駅のアナウンスは雑音で聞き取りにくい。,駅で「線名ボタンに触れてください」を「せんべい布団に触れてください」と聞き間違えた。グリーン券売機前。,True,www_1101_com_m_iimatugai_2923_html,,announcer,女性,ja
www_1101_com_m_iimatugai_2923_html_004,もやしの味噌汁,魅惑の味噌汁,料理名は聞き間違いやすい。,母が「もやしの味噌汁」と言ったのを「魅惑の味噌汁」と聞き間違えた。家庭内、料理中。,True,www_1101_com_m_iimatugai_2923_html,,mother,child,ja
www_1101_com_m_iimatugai_2923_html_005,プレーンオムレツ,プレミアムモルツ,「プレーン」と「プレミアム」は音が似ている。,母が「プレーンオムレツ」と言ったのを「プレミアムモルツ」と聞き間違えた。新聞を読んでいる時の会話。,True,www_1101_com_m_iimatugai_2923_html,,mother,child,ja
www_1101_com_m_iimatugai_2923_html_006,花粉情報,KAT-TUN情報,ニュースの固有名詞は聞き間違いやすい。,NHKニュースで「花粉情報」を「KAT-TUN情報」と聞き間違えた。テレビ視聴中。,True,www_1101_com_m_iimatugai_2923_html,,announcer,視聴者,ja
www_1101_com_m_iimatugai_2923_html_007,マンゴーアレルギー,マンボーアレルギー,電話越しは特に聞き間違いが起きやすい。,レストランの予約電話で「マンゴーアレルギー」を「マンボーアレルギー」と聞き間違えた。電話応対。,True,www_1101_com_m_iimatugai_2923_html,,customer,staff,ja
www_1101_com_m_iimatugai_2923_html_008,洗いが悪い,新井が悪い,職場では人名と動詞の聞き間違いに注意。,会社で「洗いが悪い」を「新井が悪い」と聞き間違えた。新井さんという社員がいる職場。,True,www_1101_com_m_iimatugai_2923_html,,部長他,新人,ja
