MishearID,Src,Tgt,Tips,Note,OriginalFlag,DocID,URL,SpeakerID,ListenerID,Language
www_1101_com_iimatugai_archive_more090520_html_001,歯、磨こう,鼻毛抜こう,朝の寝ぼけた状態では発音が不明瞭になりやすい,友人が泊まりに来た翌朝、寝ぼけていた私に友人が発話。聞き間違いに驚き、確認したら正しい内容が判明。,True,www_1101_com_iimatugai_archive_more090520_html,,友人,投稿者（新宿王子）,ja
www_1101_com_iimatugai_archive_more090520_html_002,電子レンジポテトチップス,電子レンジ矯正ギブス,商品名はしっかり確認しよう,会社の同じ部署の女子が話題の商品名を言ったが、聞き手が全く想像できず聞き返した。実際は全く違う商品名だった。,True,www_1101_com_iimatugai_archive_more090520_html,,同僚（女子）,投稿者,ja
www_1101_com_iimatugai_archive_more090520_html_003,足元にご注意ください,梨本にご注意ください,アナウンスは雑音で聞き取りにくいことが多い,電車内のアナウンスで「足元」を「梨本」と聞き間違えた。すぐに気づいたが、笑いをこらえるのが大変だった。,True,www_1101_com_iimatugai_archive_more090520_html,,車内アナウンス,投稿者,ja
www_1101_com_iimatugai_archive_more090520_html_004,振込に行こうと思って,振り子見に行こうと思って,早口や省略表現は誤解を生みやすい,お昼前、エレベーターで友人が「振込に行こうと思って」と言ったのを「振り子見に行こう」と聞き間違えた。振込用紙を持っていた。,True,www_1101_com_iimatugai_archive_more090520_html,,友人,投稿者,ja
www_1101_com_iimatugai_archive_more090520_html_005,渡来物（とらいもの）,ドラえもん,専門用語や難読語は聞き間違いが起きやすい,展覧会で初老のご夫婦が「渡来物」を「ドラえもん」と聞き間違えていた。しばらくして正しい意味に気づき、吹き出しそうになった。,True,www_1101_com_iimatugai_archive_more090520_html,,初老のご夫婦,投稿者（三毛猫）,ja
www_1101_com_iimatugai_archive_more090520_html_006,山本の名で予約していました,山本モナ,名前の区切りやイントネーションに注意,会議室の受付で「山本の名で予約していました」と伝えたら、受付の人が「山本モナ」と勘違いしてメモしていた。,True,www_1101_com_iimatugai_archive_more090520_html,,投稿者（山本）,受付のお姉さん,ja
www_1101_com_iimatugai_archive_more090520_html_007,不審物を見つけた方はお知らせください,真実を見つけた方はお知らせください,アナウンスは雑音や発音で誤解しやすい,電車内アナウンスで「不審物」を「真実」と聞き間違えた。哲学的な内容に一瞬驚いたが、すぐに気づいた。,True,www_1101_com_iimatugai_archive_more090520_html,,車内アナウンス,投稿者（かえる）,ja
