MishearID,Src,Tgt,Tips,Note,OriginalFlag,DocID,URL,SpeakerID,ListenerID,Language
H6E3F490D977F6CC1,降圧剤０．５ｃｃ静注,降圧剤０．５Ａ静注,うつまえに再度確認するなど確認の回数をふやす,脳出血疑いの方で当院到着時収縮期血圧１８０ｍｍＨｇと高値を認めたため、降圧目的に救急上級医より降圧剤０．５ｃｃ静注の指示だったのを０．５Ａ（５ｃｃ）と聞き間違えてそのまま静注してしまった。その後収縮期血圧は１２０ｍｍＨｇ台を保つことができ過降圧にはならなかった。,1,H6E3F490D977F6CC1,https://www.med-safe.jp/mpsearch/SearchReportResult.action,,,ja
H74BED6E4673EEBF8,A病棟,B病棟,口頭確認は正確におこなう。思いこまずに、復唱、確認を徹底する。,,1,H74BED6E4673EEBF8,https://www.med-safe.jp/mpsearch/SearchReportResult.action,病棟,看護師,ja
H7C259EB1521EC085,塩カリ,塩カル,・手術室では口答指示も多いため、必ずアンプルとシリンジに準備した薬を指示を出した医師とともに確認する。・指示は薬剤の成分名ではなく、商品名KCLで指示を出してもらう。,・口頭指示の際、医師は商品名の「KCL」ではなく成分である塩化カリウムを略して「塩カリ」と指示を出したが、看護師は「塩カル」と受け取った。・「塩カルは急ぐか」とのやり取りの際にも、医師は看護師が「塩カル」と指示を受け取っていることに気づかなかった。,1,H7C259EB1521EC085,https://www.med-safe.jp/mpsearch/SearchReportResult.action,医師,看護師,ja
H87539037AD9636E0,抗生剤だしてる,抗生剤だしとく,今回、聞き間違い・思い込み・確認不測・ルール無視と言うたび重なった誤りを起こしている。また、不足ではあるが確認行為を取っている事より誤りに気づけずにいた。　確認は最も重要な為、確認をすること、確認内容の幅を広げる、思い込みを持たない、順序を省かない、ルールを守る。,担当医訪室あり状態報告。体温上昇に対し「抗生剤だしてる」を「抗生剤だしとく」と聞き違える。これから先の処方だと思い込み、オーダー確認し本日処方確認、夕食後での指示面を見て早く飲ませた方がよいだろうと思い、薬局へ行かずに他患者分の１錠を借りて２３時３０分に服用行う。,1,H87539037AD9636E0,https://www.med-safe.jp/mpsearch/SearchReportResult.action,,,ja
H8D05FF54D5F3BEF1,筋肉注射,静脈注射,指示を復唱する。,今までは乳頭確認後に静脈注射していたため、施行指示を確認した際にすぐに静脈注射したが、静脈注射後に施行医師より筋注と言ったと指摘を受けた。,1,H8D05FF54D5F3BEF1,https://www.med-safe.jp/mpsearch/SearchReportResult.action,施行医師,,ja
H8DE79DE9CB4B5FC8,アドナ・トランサミンカプセル,アドナ・トランコロン,電話での連絡のみであり、メモなどで筆記させる必要があったと考える。日中と違い当直中の出来事だったので、尚更確認が重要である。,右眼硝子体出血を認める患者に対して、アドナ・トランサミンカプセルを処方するところをアドナ・トランコロン錠を処方した。当直中であり慌てていたとのことであるがしっかりと処方内容の確認をすべきである。,1,H8DE79DE9CB4B5FC8,https://www.med-safe.jp/mpsearch/SearchReportResult.action,,,ja
H97CDF35E61389A42,レミフェンタニルを1cc／h,レミフェンタニルを1cc,未記入,,1,H97CDF35E61389A42,https://www.med-safe.jp/mpsearch/SearchReportResult.action,,,ja
H9C7E7008EE18BDB5,２６単位,２８単位,口頭指示を受けるときは指示の復唱を確実に行う。メモをとりながら、指示を受ける金曜までに週末のオーダーが入っているか確認する,,1,H9C7E7008EE18BDB5,https://www.med-safe.jp/mpsearch/SearchReportResult.action,医師,,ja
HA12B023D01BCDE760,負荷時間５,フサン時間５,緊急時以外はなるべく指示画面による指示を受けるようにする。口頭指示を受けた場合は必ず復唱する。医師の指示の意味を考えて行動するようにする。,ＥＣＬＨＡ装着中の患者。フサン２０ｍｇ／５％Ｇ４０ｍｌを６ｍｌ／Ｈ、ＦＦＰ５０ｍｌを１０ｍｌ／Ｈで投与されていた。４時頃医師により「フサン時間５」という口頭指示を受けフサンの流量を変更した。当事者はその旨を他看護師に報告し休憩にいく。休憩から戻り口頭指示を出した医師よりフサンの流量の変更について問われ、当該医師による口頭指示で流量変更をしたことを説明するが医師に覚えがなく「負荷（ＦＦＰ）時間５」の聞き間違えであったことに医師、当事者、他看護師が気がつく。,1,HA12B023D01BCDE760,https://www.med-safe.jp/mpsearch/SearchReportResult.action,医師,,ja
HAB1891E5534DE4CEF,0.5mL,0.5mg,復唱ははっきりと聞こえるように行う。投与前にはバイタルサインを確認する。疑問に感じた事は解消してから実施する。,手術途中、麻酔科医より0.5mL静脈注射の口頭指示が出た。0.5mgの指示と聞き間違え、「5mL/0.5ｍｇIVします」と復唱し投与開始した。2mL投与したところで、麻酔科医が間違いに気づき指摘を受け、投薬を中止した。体格の大きい人なので通常より大量を入れるのだろうと思った。,1,HAB1891E5534DE4CEF,https://www.med-safe.jp/mpsearch/SearchReportResult.action,麻酔科医,,ja
HD6F67C817825D094,インテバン坐薬,アンヒバ坐薬,口頭指示を受けた際、カルテに記載してあるかを確認し、薬剤を使用する場合には、スタッフと必ずダブルチェックを行う。また、薬剤についての知識が足りないため、学習を行っていく。,口頭指示を聞き間違え、思い込みをしたため、インテバン坐薬を使用しなければいけないところを誤って、アンヒバ坐薬を使用してしまった。,1,HD6F67C817825D094,https://www.med-safe.jp/mpsearch/SearchReportResult.action,,,ja
HD908EF85EA9A18B6,半筒,３筒,医師・看護師共に半筒と３筒が聞き間違えを起こしやすいことを共有認識する。医師は口頭指示の場合、半筒という言葉を使用しない。１/2A・0.5Aとかの表現で指示を出す。看護師も同様に復唱するときは分かりやすい言葉で聞きなおす。指示内容に疑問を感じたときは、他の勤務者や薬剤師に相談する。,電話での口頭指示にて、聞き取り間違いが起こった。口頭指示箋を使用しなかった。口頭指示にて聞きなおして確認しているが半筒と３筒を間違えるリスクが高いことを認識していなかった。患者様の状態をアセスメントできておらず、過剰投与に至った（患者様は以前もブスコパン使用時に頻脈となった経緯あり）。情報共有できていなかった。同勤務者は過剰だと思ったが、電話でＤｒに再確認するのを聞いていたので間違いだと思わなかった。薬剤科にも確認することを思いつかなかった。実施済処方にて薬剤師もチェックがかからなかった。前回、頻脈となった経緯あったが、情報を共有が出来ていなかった。,1,HD908EF85EA9A18B6,https://www.med-safe.jp/mpsearch/SearchReportResult.action,医師,,ja
HDAC01CC61E564CE2,塩化ナトリウム,塩化カリウム,薬剤師は、薬剤持参時に注射処方箋をもとに看護師と確認を行う。,救急外来で医師より塩化ナトリウム補正液の口頭指示が出た。薬剤部に薬剤を持ってきてもらうよう電話で連絡した。薬剤師は、塩化カリウムと聞き間違え、ＫＣＬ注を持っていった。,1,HDAC01CC61E564CE2,https://www.med-safe.jp/mpsearch/SearchReportResult.action,医師,薬剤師,ja
HE2D918C1E410180D,薬が来たら飲ませとって,薬が来たら置いといて,口頭指示を受けない　もし、受けた場合はメモを取るなどし必ず復唱し再度確認を行う　与薬マニュアルをもう一度見直す　５Ｒ：声だし・指差し呼称をする,日勤の看護師より申し送り後、「薬が来たら飲ませとって。」と聞こえた。オーグメンチンの内服薬が薬局からきた際、投薬開始日が翌日になっており、不信に思いカルテを確認した。しかし、カルテにも翌日～開始と書いてあった。本日分のオーグメンチンが飲んだかどうか確認できなかった為、本人の薬袋を確認する為薬箱を開いたが薬袋を確認することが出来ず、遅出、同じチームの看護師に確認するが分からなかった。しかし、飲ませなければならないと思い、翌日開始分の内服薬を飲ませてしまった。申し送り時、に「オーグメンチン飲ませました。」と言うと、　「置いといてと言った」と言われ、聞き間違っていたことに気付いた,1,HE2D918C1E410180D,https://www.med-safe.jp/mpsearch/SearchReportResult.action,看護師,看護師,ja
HE60CF647DD2910F1,サンビャクヒャクお願いします,サンナナヒャクお願いします,フローチャートを作成・使用することで関連するスタッフ間で使用造影剤を含め情報共有を行い造影検査を実施する。また、医師・看護師・技師の3者でフローチャートを活用したチェックバックを徹底していく。また、有害事象発生時は技師のみで判断するのではなく、画像診断部医師または依頼科医師に報告することを部署で徹底していく。,技師Aは本検査で使用するのは「オイパロミン300注100ｍL」であるので、看護師に「（オイパロミン300・100）サンビャクヒャクお願いします」と口頭で指示。看護師は「（オイパロミン370・100）サンナナヒャク」と聞き間違え「オイパロミン370注100ｍL」を準備しインジェクターにセット。技師Bが「オイパロミン秒1.5入ります」と発信し注入を開始した際に、技師Cが造影剤のシリンジの色が異なることに気付き12ｍLはいったところで注入を止めた。,1,HE60CF647DD2910F1,https://www.med-safe.jp/mpsearch/SearchReportResult.action,,,ja
