MishearID,Src,Tgt,Tips,Note,OriginalFlag,DocID,URL,SpeakerID,ListenerID,Language
A215C215E6370BE28,これは100マイクロか,これは100mgか,・冠攣縮誘発試験に使用する薬剤(オビソート)の希釈方法について、誰が見てもわかりやすい手順書(画像使用)へ変更した。・看護師が担当する業務を采配する際は、経験録と技術評価をもとに配置する。また、経験の有無について担当者本人への確認を徹底する。 ・薬剤使用時は必ず看護師2名、もしくは看護師と医師によるダブルチェックを実施する。また、タイムアウトの際は特異性がある薬剤を使用することを発生し全員で情報を共有する。,看護師は、医師Aから「オビソートを溶かして」と準備依頼を受け、オビソートの準備を開始。看護師は手順を確認しながら医師Aへ「オビソート1Aを生食10mlで溶かせば良いですか」と確認すると「それでいい」と返答がありオビソート100mg1Aと生食10mlを溶解した。看護師が作成したオビソートのシンリンジを提供する際に、医師Bから「これは100マイクロか」と確認されたが、看護師は100mgと聞き間違え「はい」と返答した。,1,A215C215E6370BE28,https://www.med-safe.jp/mpsearch/SearchReportResult.action,医師,看護師,ja
A3A19D863B70C304F,等比重でいいですか,高比重でいいですか,マーカインの等比重、高比重は聞き間違えやすく、規格もどちらも0.5%であるため、確認時には「等しい方ですか」「高いほうですか」など聞き方を変えて聞き間違いが起こらないような確認を行う。また、口頭のみでなく、薬品名を見ながら指差し呼称、ダブルチェックを徹底して行う。予定手術の際は、口頭指示でのやり取りを少なくするため、あらかじめ使用薬剤のオーダー、指示書での確認、準備ができるよう、システムを改善中である。当該科での脊髄麻酔時は、高比重マーカインのみを使用するルールとした。,等比重と高比重は聞き間違えやすいものであり、医師は高比重と思いながら、「等比重でいいですか」との看護師の確認に「それでいい」と答えたことでエラーが発生した。看護師が薬を準備した際に、口頭確認だけで、医師に薬を見せて薬品名を確認するというダブルチェックが行われず、医師に薬を渡す際にも薬のダブルチェックが行われなかった。本来のルールが守られていなかったことが要因である。,1,A3A19D863B70C304F,https://www.med-safe.jp/mpsearch/SearchReportResult.action,看護師,医師,ja
A594B64FC6D49F945,プロタミン,ドブタミン,・医師、看護師によるダブルチェックを厳守する。・投与内容に疑問がある場合、医師以外のスタッフにも確認する。,・指示を受けた看護師がプロタミンという薬剤を知らず、ドブタミンと聞き間違えた。・ドブタミン投与前、看護師は医師に薬剤のアンプルを見せて確認し、投与前にも口頭で再度確認したが、誤りに気付かなかった。,1,A594B64FC6D49F945,https://www.med-safe.jp/mpsearch/SearchReportResult.action,医師,看護師,ja
A70EFE685048D1274,入室不可,入室可能,１．ＭＲＩ検査室の前室での持ち物確認が終了するまで入室しないよう技師が必ず説明する。また、持ち物確認が終了するまでＭＲＩ検査室のドアを閉めておく。２．ＭＲＩ検査室入室時に金属探知機のブザーが鳴ったら必ず立ち止まることを徹底する。３．救急科医師、ＴＣＣ看護師にＭＲＩ検査実施時の注意点を再周知する。,１．医師が患者をＭＲＩ検査室に入室させてよいか口頭で確認したところ、技師は「入室不可」と返事をした。しかし、医師は技師の返事を「入室可能」と聞き間違えてＭＲＩ検査室に入室した。また、ＭＲＩ検査室のドアが半分開いていたため、入室可能と医師が誤認した。２．磁性体のＭＲＩ検査室への持ち込みが禁忌であることを医師が十分に認識していなかった。３．ＭＲＩ検査室の入口の金属探知機のブザーがよく鳴るため、危険意識が薄れていた。,1,A70EFE685048D1274,https://www.med-safe.jp/mpsearch/SearchReportResult.action,技師,医師,ja
A8BCEBDC7562F792E,9番MRI室,救急MRI室,1.コードブルーのシステムの見直しを図る。全職員に対して、再度コードブルーの周知を行う。2.MRI検査中の患者の安全確保。技師は撮影に集中し操作していることから、一人では観察が十分にできず、患者の変化に気づけない可能性があるため、酸素を使用中の患者や、重症患者の検査の場合は看護師が観察を行うようにする。3.検査中の急変対応について、これまで同様に月に1回訓練を実施していく。,3.コードブルーにおいては、電話で要請し、電話を受けた事務職員が一斉放送をする仕組みとなっている。コードブルー要請時、発生場所を伝えるが「9番MRI室」と伝えたが、「救急MRI室」と聞き間違いが発生し、その場所の確認を行い放送が遅れた。事務職員のコードブルーに対する認識も薄かったと考えられた。,1,A8BCEBDC7562F792E,https://www.med-safe.jp/mpsearch/SearchReportResult.action,,,ja
A8CA4189851874303,持ってきていない,飲んでいない,持参薬の有無の確認を、薬剤師が実施するよう体制を整える。ロータブレーダー後には、血栓性閉塞がおきやすいので、医師は抗凝固薬が投与されているかを確認する。電子カルテの指示画面等についても、必要な情報を得られるようにシステム変更を検討する。 ・病棟と薬剤部で検討し、別の病棟を担当する薬剤師が当該病棟の担当薬剤師をバックアップし、常駐薬剤師と同じく患者が持参薬を持っているかどうか直接面談して情報を得ることにした。・入院時の持参薬管理は、看護師を介入せず、薬剤師が持参薬の管理を行なうことにした。薬剤師は持参薬の有無に関わらず電子カルテへ持参薬について入力することにし、持参薬はあるが、持参されなかった薬についても取りこぼしがないように管理することとなった。・薬剤部で抗凝固剤などの中止や再開忘れがあった情報を収集し、検討することにしている。・処方薬剤数が多い患者では「実施入力画面」の表示に時間がかかるため、医療情報部から「実施入力画面」の画面表示のレスポンス改善の申し入れをメーカーに行なっているところである。・処方の服用確認方法を周知徹底するため、各部署に文書で「患者が処方薬を服用したか確認できるのは『実施入力画面』だけです。」と注意喚起を行なった。・総合入院センターで患者の持参薬を確認してから、病棟に入院することができるか検討したい。,川崎病冠動脈瘤の既往がある患者で、入院前よりバイアスピリンを継続内服していた。入院時患者は、外来で処方されたバイアスピリンを持参しなかった。医師はバイアスピリンを持参して継続内服しているものと思い込んだ。看護師も母親に薬の確認をしたが、「持ってきていない」を飲んでいないと聞き間違い、そう思いこんだ。,1,A8CA4189851874303,https://www.med-safe.jp/mpsearch/SearchReportResult.action,患者の母親,看護師,ja
A8E7ED2C5F1DD6C64,アドレナリン1mg iv,ノルアドレナリン1mg iv,・心肺停止時のアルゴリズムや急変時対応について、部署教育の充実。・医療者間の連携およびコミュニケーションの強化（チェックバックを機能させる）。,患者がくも膜下出血に由来する心肺停止状態となり、CPRが開始された。医師からの「アドレナリン1mg iv」の指示を、看護師Aは「ノルアドレナリン1mg iv」と聞き間違え、ノルアドレナリン1mgを準備し側管から静注した。看護師Bが使用後の空アンプルを見て、誤投与が判明した。,1,A8E7ED2C5F1DD6C64,https://www.med-safe.jp/mpsearch/SearchReportResult.action,医師,看護師,ja
A92CAA92595CFEA0F,皮下注射,筋肉注射,・医師にも指示簿を声出し確認をするよう促す。・経験が浅い医師の場合は声掛けも行いながら実施する。・医師が穿刺する際は児から目を離さずに介助に入る。・研修医が一人で，特に初回手技時は上級医の監視下のもとに行う。,,1,A92CAA92595CFEA0F,https://www.med-safe.jp/mpsearch/SearchReportResult.action,,研修医,ja
AA00B2C03C66067AD,アドレナリン,ノルアドレナリン,・蘇生時は現場が緊迫した状況となり煩雑化しやすい。医師は薬剤名・投与量・投与方法を明確に指示する。指示受け側も復唱による確認を行う。・急変時対応の薬剤使用を含めた訓練を行う。・薬剤の名称一部が同じであるため救急カート内の配置薬品の再検討を行う。,・医師Aは「アドレナリン」と指示を出したが、指示を受けた看護師は「ノルアドレナリン」と聞いており、ノルアドレナリン1mgをシリンジに吸い医師Bへ渡した。医師Bは手渡されたものがアドレナリンと思い患者へ投与した。・医師がノルアドレナリンと指示を誤ったのか、看護師が聞き間違えノルアドレナリンを準備したのかは不明。,1,AA00B2C03C66067AD,https://www.med-safe.jp/mpsearch/SearchReportResult.action,医師,看護師,ja
AAC2FA3F396C1C45C,パーキロ0.2mgで,パーキロ2mgで,・回診時のコンサルテーション内容は、メモをとり、診療録に必ず記載する。・病棟で使用する薬剤一覧表（用量換算表）の作成と掲示。・明確な疑義照会が出来るように啓発ポスターを掲示する（疑問に思った量や内容・投与方法等を声に出し、一緒にワークシートを指差して確認しあう）・使用しなれていない、あるいは初めて使用する薬剤は、事前に医薬品情報を検索してから使用するよう、啓発ポスターを掲示する。・ローテートしてくる研修医と病棟医への病棟オリエンテーションの強化。・薬剤部では、抗てんかん薬の散薬装置瓶に小児薬用量を表示し、調剤時必ず確認する。・病棟担当薬剤師の病棟業務時間を10時間/週→15時間/週に増加させ、処方鑑査を強化する。・コンピュータシステム上の改善をする（医師が処方指示をする際、患者の体重から薬剤適応量を計算し、設定量逸脱時はアラート表示がされる。）,・病棟医は週1回の神経回診時に、小児神経医師へ患者の痙攣に対する薬剤コントロールについて相談した際、小児神経医が「マイスタンをはじめてみてはどうか。パーキロ0.2mgで」と口頭でアドバイスしたが、病棟医には指示量が「パーキロ2mgで」と聞こえていた。また、病棟医はその際メモをとらなかった。,1,AAC2FA3F396C1C45C,https://www.med-safe.jp/mpsearch/SearchReportResult.action,小児神経医,病棟医,ja
AB81DCB019EF78EBB,陽性,良性,病理結果の報告が詳細ではなく、曖昧な単語であった場合には、しっかりと確認する必要がある。確認の際にも聞き間違えの生じやすい言葉ではなく、より具体的な「断端に異型細胞はない、陰性、Negativeということで間違いないか？」等、一意にとれるよう注意する。,現在、手術室での迅速病理診断の結果は、OPE室の電話（スピーカー）を用いて口頭でのやり取りとしているが、病理診断科からの報告は「陽性、Positive」や「陰性、Negative」等の聞き間違いが生じにくい単語に加え、有意所見があった場合は「断端に異型細胞があるため癌親展を疑う」等の詳細所見を加えて伝えられることが多いが、今回は「陽性」の一言だけだったため誤認を生じた。,1,AB81DCB019EF78EBB,https://www.med-safe.jp/mpsearch/SearchReportResult.action,病理診断部,看護師,ja
AC54EF98B1189CA09,ドブタミン投与,プロタミン投与,・人工心肺の離脱時には麻酔科上席医が必ず在席することを原則とし、執刀医および臨床工学技士等、手術チームメンバーも、麻酔科上席医の存在を確認した上で離脱を行うこととした。・執刀医、麻酔科医、他手術チームメンバーは薬剤投与などの指示を受けた場合は、必ず復唱し確認しあうことを徹底する。・ヘプコン(血中ヘパリンに対する拮抗プロタミン量測定器)の導入を検討する(麻酔科医業務の負担軽減とヒューマンエラー防止のため),人工心肺を使用する心臓外科手術において、執刀医からのドブタミン投与との指示をプロタミンと聞き間違え、人工心肺から離脱する前に麻酔科医によりプロタミンが投与された。半分量を投与した時点で麻酔科医師が投与したことを報告したため、誤りが発覚。,1,AC54EF98B1189CA09,https://www.med-safe.jp/mpsearch/SearchReportResult.action,執刀医,後期研修医,ja
AD87985C41829E3CC,ドパミン6mL/h,ドブタミン6mL/h,・カテーテル室の術中なので口頭指示になるのは回避できない。・口頭指示を受けた時には、口頭指示した医師に聞こえるように、薬剤名、用法用量を復唱する（カテ室では遮蔽版や機械類の音で声が聞こえづらいこともあるため）。・投与前にも看護師は医師と薬剤実物を一緒に目視し、薬剤名、用法用量を復唱しWチェックする。・カテーテルなどの物品は医師とのダブルチェックを行っており、同様に、緊急時の口頭指示薬は危険薬が多いため、医師に必ず見せて確認する。,アブレーション中に収縮期血圧60まで低下あり。カテーテル終了時にドパミン6mL/h投与の口頭指示があったが、カテ室担当看護師はドブタミンと聞こえたため、ドブタミンと復唱し、ドブタミンを6mL/hで繋げた。収縮期血圧90台まで上昇し病棟に帰室。そこで受け持ち看護師が気付いた。,1,AD87985C41829E3CC,https://www.med-safe.jp/mpsearch/SearchReportResult.action,医師,看護師,ja
ADA7460CC0CD19F71,プロタミン２ｍＬ,ドブタミン２ｍＬ,マニュアルを遵守する。緊急時の体制については救急部のマニュアルを見直し、院内マニュアルとの整合性を確認する。,,1,ADA7460CC0CD19F71,https://www.med-safe.jp/mpsearch/SearchReportResult.action,医師,看護師,ja
AE8CED0BDD6039273,陽性,陰性,・病理結果が報告されたら術者による復唱及び病理医は必ず間違いないことを確認する。・結果報告は、2名で確認し実施しているが、術者とのやりとりを確認するため報告者側もスピーカーホーンにして報告する。・センチネルリンパ節の迅速病理においては、病理依頼書に結果を記載した記録を気送管（またはFAX）で手術室に送る。,右乳癌に対してセンチネルリンパ節生検を行い、生検の術中迅速病理診断の結果次第で腋窩リンパ節廓清術を追加するかを決定する方針で手術が行われた。術中にセンチネルリンパ節1個を提出し、術中迅速の結果は手術室内で病理医より内線電話で結果を聞いた。病理医は、診断結果を2名で確認して電話を行った。内線電話は、病理より電話があった時点でスピーカー設定にして手術室内の乳腺外科医2名、後期研修医、初期研修医、医学生、看護師2名、麻酔科医にも聞こえる状態であった。応答から陰性と確信して腋窩への追加処置は行わずに手術を終えた。患者へは、麻酔郭清後に迅速の結果は陰性であったことを伝え、最終的な判断は、術後のパーマネント報告を受けてからとなることを伝えた。術後6日目に退院した。同日の夜間に外来予約のある患者のカルテを一通り確認している際、当該患者の病理迅速診断報告の記録（病理診断結果、陽性）と術者の認識に齟齬があることに気づいた。,1,AE8CED0BDD6039273,https://www.med-safe.jp/mpsearch/SearchReportResult.action,病理医,手術チーム（乳腺外科医2名、後期研修医、初期研修医、医学生、看護師2名、麻酔科医）,ja
AEBBA852F7AB99904,ノルアドレナリン,アドレナリン,・口頭指示受けマニュアルの再周知（復唱すること）。・急変時対応の学習会。,急変時であり、口頭指示のノルアドレナリンをアドレナリンと聞き間違えた。ノルアドレナリン5Aの指示であったが、救急カート内の定数は2Aしかなかった。この病棟では急変対応時にノルアドレナリンでの昇圧指示はまれであった。,1,AEBBA852F7AB99904,https://www.med-safe.jp/mpsearch/SearchReportResult.action,,,ja
H0322FBB58A5268B0,0.5ｍｌ,2.5ｍｌ,指示の復唱、声出し確認をする。残量ではなく基本的に投与量を声に出して使用する。ダブルチェックを確実にする。,鎮静下にて胃内視鏡検査実施中、検査開始時にミダゾラム2.5ｍｌ次に0.5ｍｌ投与し残7ｍｌで3回目のミダゾラム投与時、医師の指示0.5ｍｌを2.5ｍｌと聞き間違えて投与してしまった。,1,H0322FBB58A5268B0,https://www.med-safe.jp/mpsearch/SearchReportResult.action,医師,,ja
H06BA1056BCCF90E9,台を下して,左を下して,きちんと聞き返す。相手の反応を確認する。,執刀医に指示されて手術台をリモコンで操作するときに「台を下して」と指示されたが、「左を下して」と聞き間違えて、「左を下します」と言って一瞬操作を左回転ボタンを押した。すぐに訂正が入り、元に戻した。,1,H06BA1056BCCF90E9,https://www.med-safe.jp/mpsearch/SearchReportResult.action,執刀医,,ja
H165DF37F27BCD0CC,「OPまでソセゴンはいかないで」,「OP前にソセゴンをいって」,指示内容の復唱を徹底する。口頭指示メモを使用する。,10／29　18：14看護師Aは腹痛に対し医師指示にてソセゴン15mg0．5Aを側管より静注した。19：00看護師Aは腹痛が軽減していないことを医師へ報告した際に、医師が「OPまでソセゴンはいかないで」と指示したが、看護師Aは「OP前にソセゴンをいって」と聞き間違った。,1,H165DF37F27BCD0CC,https://www.med-safe.jp/mpsearch/SearchReportResult.action,医師,看護師,ja
H206B9C808BCCCBF5,追加,側管,緊急でオーダーが入り、行う時は又聞きをせず、自己にて確認をし行うようにする。,内科医師より、アドナ注５０mg・１０mLのオーダーが入り、他のスタッフから混注したものを受け取る。《５００mL》ソルデム３Ａ注に追加と言われたが、聞き間違えをしてしまい、側管からと判断し施行してしまった。すぐにバイタルサイン測定を行い、変化無し。,1,H206B9C808BCCCBF5,https://www.med-safe.jp/mpsearch/SearchReportResult.action,内科医師,,ja
H29F69757CA274D06,10倍組成でつくって欲しい,10Aで作って欲しい,・急変時はオーダーを待っての混注や投与が困難となることも多いため、復唱したり医師と確認して投与するようにしていく。,急性心筋梗塞に対しPCI後、VF蘇生後にICU入室している患者を受け持っていた。当日の10時にPCPS抜去し、2時間程経過していたが徐々に血圧低下したため麻酔科医師に報告、ノルアドレナリン開始の指示をもらった。その際に医師より「10倍組成でつくって欲しい」と言われたが「10Aで作って欲しい」と聞き間違えてしまった。,1,H29F69757CA274D06,https://www.med-safe.jp/mpsearch/SearchReportResult.action,医師,,ja
H2BB6C1F38D96DDF7,ガドビスト6ml,ガドビスト5ml,Wチェックを徹底していく,2棟CT室で放射線技師よりガドビスト6mlを準備するよう指示があったが、5mlと聞き間違えをしていた。ガドビスト6mlのラインで線を引き、放射線技師にWチェックしてもらうよう声をかけたところ5mlであることが判明。ラインを引き直し再度Wチェックを行ったうえで造影剤を注入した。,1,H2BB6C1F38D96DDF7,https://www.med-safe.jp/mpsearch/SearchReportResult.action,放射線技師,,ja
H403426EACB339109,ＤＴ１４１,ＤＴ２４０,医師への報告の際にお互い内容を復唱する注射の投与量が多いと思ったら、もう１度値の確認をする,ＤＴ１４１であった。ＤＴ１２０以上で医師への報告が必要なためＤｒへＴＥＬで報告した。本人持ちのインスリン実施の指示があり、実施した。インスリン指示の際、その後の点滴に糖が入っていないことなど確認をした。その後医師のカルテより、ＤＴを２４０と認識されていたことに気づき医師へ連絡。,1,H403426EACB339109,https://www.med-safe.jp/mpsearch/SearchReportResult.action,,医師,ja
H45D0362913CE1281,CVP測定,CVのライン固定,今起きていることが、患者さんの命に関わることなのか、今すぐ処置をしなければいけないことなのかを考えて優先順位の判断を行う。先輩看護師に自分の考えを伝えて、考え方が間違ってないかを確認する。いつでも不安や疑問に思うことは声に出して伝える。また、医師や他看護師に言われたことを復唱し解釈が間違ってないかを、その都度確認する。不安なことは実施する前に準備物品や手順を書いたメモをみて、準備と手順を振り返り確認する。とりあえず行うのではなく一つのことを正確に終わらせてから、次のことに取りかかるようにする。終わっていないことがあれば、他の看護師に声に出して伝え、待ってもらう。フリーハンドで滴下させる知識と技術を身につける。正しい速度で滴下されているかの確認を行う。,先輩看護師がトレーニング中の看護師と一緒にCVP測定を行うのでとっておいてと言われたが、CVP測定ではなくCVのライン固定を行うと聞き間違った。そのためCV挿入部の固定を先に行った方が2度手間にならないと思い、CV挿入部の固定を行った。,1,H45D0362913CE1281,https://www.med-safe.jp/mpsearch/SearchReportResult.action,先輩看護師,トレーニング中の看護師,ja
H4AB042F0411B8571,111,211,測定した値を聞くだけでなく、血糖測定器の履歴から目で確認する。実施時、スライディングスケールの該当欄を看護師・患者の双方で確認する。,既往確認すると、患者は１１１と言ったが看護師は２１１と聞き間違え、インスリンを２単位投与してしまったことがわかった。当直の医師に報告し、インスリンの過剰投与と夕の血糖が１８５であることを伝え、経過観察の指示を受ける。聞き間違いをした。普段血糖が２００台の患者であった為、インスリンを打つだろうと思い込みをしてしまった。,1,H4AB042F0411B8571,https://www.med-safe.jp/mpsearch/SearchReportResult.action,患者,看護師,ja
H4E52C44C7581B6C5E7,バイアスピリン,アムロジピン,依頼を受けた際、内容の復唱を行う。中止薬の抜き出し後は必ずダブルチェックを行う。,口頭で中止薬の取り出しを依頼をされた。その際に抜き取る薬剤の復唱確認を行わなかったため、バイアスピリンを抜いてと依頼されたが、アムロジピンだと聞き間違え思い込んでいた。薬剤を取り出した後にダブルチェックを行い、取り出し間違いに気づくことができた。,1,H4E52C44C7581B6C5E7,https://www.med-safe.jp/mpsearch/SearchReportResult.action,看護師,,ja
H5A2FB94326C62C67,５０％ブドウ糖液２アンプル,５％ブドウ糖２アンプル,口頭指示受け時の復唱確認。　中途採用者、新人の教育を徹底する。,,1,H5A2FB94326C62C67,https://www.med-safe.jp/mpsearch/SearchReportResult.action,,,ja
