MishearID,Src,Tgt,Tips,Note,OriginalFlag,DocID,URL,SpeakerID,ListenerID,Language,Tags,Envs
coffee_break_parts_similar202209_001,量的に微妙なので、ここは記書きではなく、再考したほうが～,量的に微妙なので、ここは気が気ではなく、再考したほうが～,「記書き」と「気が気」は音が似ているので注意,会議中の発言を速記者が文字起こしする際に発生。文脈から「記書き」が正しいが、音が似ているため誤記。,True,coffee_break_parts_similar202209,N/A,発言者,速記者,日本語,"['ビジネス', '行政', '速記', '聞き間違い', '日本語', '会議']",['文字起こし']
coffee_break_parts_similar202209_002,将来的な移管については、一定、話をつけておりますので～,将来的な移管については、行って、話をつけておりますので～,「一定」と「行って」は発音が近い,移管に関する説明の場面で、速記者が「一定」を「行って」と誤記。文脈から「一定」が正しい。,True,coffee_break_parts_similar202209,N/A,発言者,速記者,日本語,"['ビジネス', '行政', '速記', '聞き間違い', '日本語', '会議']",['文字起こし']
coffee_break_parts_similar202209_003,こちらのサービスは3月末で終了し～,こちらのサービスは3月末で就労し～,「終了」と「就労」は音が似ている,サービス終了の案内で、速記者が「終了」を「就労」と誤記。文脈から「終了」が正しい。,True,coffee_break_parts_similar202209,N/A,発言者,速記者,日本語,"['ビジネス', '行政', '速記', '聞き間違い', '日本語', '会議']",['文字起こし']
coffee_break_parts_similar202209_004,お話はもう全くごもっともですが、役所の徴税コストのことも～,お話はもう全くごもっともですが、役所の調整コストのことも～,「徴税」と「調整」は音が似ている,役所のコストに関する議論で、速記者が「徴税」を「調整」と誤記。文脈から「徴税」が正しい。,True,coffee_break_parts_similar202209,N/A,発言者,速記者,日本語,"['ビジネス', '行政', '速記', '聞き間違い', '日本語', '会議']",['文字起こし']
coffee_break_parts_similar202209_005,方向性につきましては、私どもも賛成でございまして～,方向性につきましては、私どもも反省でございまして～,「賛成」と「反省」は音が似ている,方向性に対する意見表明の場面で、速記者が「賛成」を「反省」と誤記。文脈から「賛成」が正しい。,True,coffee_break_parts_similar202209,N/A,発言者,速記者,日本語,"['ビジネス', '行政', '速記', '聞き間違い', '日本語', '会議']",['文字起こし']
