MishearID,Src,Tgt,Tips,Note,OriginalFlag,DocID,URL,SpeakerID,ListenerID,Language,Tags,Envs
coffee_break_parts_similar202011_001,統計でいうところの偽陽性の排除の手法として～,統計でいうところの行政の排除の手法として～,専門用語（偽陽性）は文脈で確認を。,統計の専門用語「偽陽性」を「行政」と聞き間違えた。速記者が専門用語に不慣れだった可能性がある。発話者は統計の専門家。,True,coffee_break_parts_similar202011,N/A,不明,速記者,日本語,"['行政', '統計', '速記', '聞き間違い']",['文字起こし']
coffee_break_parts_similar202011_002,コンクリートですが、結局、増し打ちをして～,コンクリートですが、結局、ま、周知をして～,建設用語「増し打ち」は注意。,建設現場での専門用語「増し打ち」を「ま、周知」と聞き間違えた。現場の騒音や発話の不明瞭さが原因か。発話者は建設関係者。,True,coffee_break_parts_similar202011,N/A,不明,速記者,日本語,"['建設', '速記', '聞き間違い']",['文字起こし']
coffee_break_parts_similar202011_003,部署の枠組みを超えてミッションを組んで取り組んだ成果が～,部署の枠組みを超えて密使を組んで取り組んだ成果が～,カタカナ語（ミッション）は文脈で再確認。,ビジネス用語「ミッション」を「密使」と聞き間違えた。カタカナ語の発音が不明瞭だった可能性。発話者はビジネスパーソン。,True,coffee_break_parts_similar202011,N/A,不明,速記者,日本語,"['ビジネス', '速記', '聞き間違い']",['文字起こし']
coffee_break_parts_similar202011_004,土壌の持つ水源涵養機能というものが～,土壌の持つ水源関与機能というものが～,専門用語（涵養）は要注意。,環境分野の専門用語「涵養」を「関与」と聞き間違えた。専門用語の知識不足や発音の類似が原因。発話者は環境分野の専門家。,True,coffee_break_parts_similar202011,N/A,不明,速記者,日本語,"['環境', '速記', '聞き間違い']",['文字起こし']
coffee_break_parts_similar202011_005,合間に何度も連絡はしてはきてますんで～,曖昧に何度も連絡はしてはきてますんで～,同音異義語は文脈で判断。,「合間」を「曖昧」と聞き間違えた。日常会話での同音異義語の混同。発話者は一般職員。,True,coffee_break_parts_similar202011,N/A,不明,速記者,日本語,"['速記', '聞き間違い']",['文字起こし']
