MishearID,Src,Tgt,Tips,Note,OriginalFlag,DocID,URL,SpeakerID,ListenerID,Language,Tags,Envs
www_1101_com_iimatugai_2010-11-03_html_001,Public Organization,Pubic Organization,スペルチェックを活用しよう。,アメリカ在住の日本人がチームミーティングのプレゼンでタイプミス。英語のスペルミスによる聞き間違い。,True,www_1101_com_iimatugai_2010-11-03_html,N/A,ももちゃん,チームメンバー,英語,"['言い間違い', 'タイプミス', '英語', '非母語話者', 'ユーモア']","['オンライン会議', 'プレゼン', '職場']"
www_1101_com_iimatugai_2010-11-03_html_002,childhood,food,質問の意図をよく確認しよう。,英語塾で「好きだった先生は？」と聞かれたが、「childhood」と「food」を混同し「豆腐」と答えてしまった。,True,www_1101_com_iimatugai_2010-11-03_html,N/A,投稿者,英語教師,英語,"['聞き間違い', '英語', '非母語話者', 'ユーモア']","['英会話教室', '対面会話']"
www_1101_com_iimatugai_2010-11-03_html_003,Allan（アラン）,Allen（アレン）,名前の発音ははっきり区別しよう。,アメリカの職場で中国人上司Allanと同僚Allenの発音が似ていて、聞き手が混乱。発音の不明瞭さが原因。,True,www_1101_com_iimatugai_2010-11-03_html,N/A,投稿者,同僚,英語,"['発音', '聞き間違い', '英語', '非母語話者', 'ユーモア']","['職場', 'オフィス', '日常会話']"
www_1101_com_iimatugai_2010-11-03_html_004,マークさんもカムのっ！,マークさんも噛むの！,日本語と英語の同音異義に注意。,アメリカ在住の日本人がパーティーで「マークさんもカムのっ！」と言い、「噛むの」と聞こえてしまい自分で突っ込む。,True,www_1101_com_iimatugai_2010-11-03_html,N/A,ちゃんこちゃこちゃん,友人,日本語/英語,"['言い間違い', '聞き間違い', '日本語', '英語', '非母語話者', 'ユーモア']","['家庭', 'パーティー', '日常会話']"
www_1101_com_iimatugai_2010-11-03_html_005,オクトパス（octopus）,オクトーバー（October）,英単語の類似発音に注意。,韓国人の友人がレストランで「squid（イカ）」を「オクトーバーの白いやつ！」と説明。octopusとOctoberを混同。,True,www_1101_com_iimatugai_2010-11-03_html,N/A,韓国人の友人,投稿者,英語,"['言い間違い', '聞き間違い', '英語', '非母語話者', 'ユーモア']","['レストラン', '日常会話', '異文化コミュニケーション']"
www_1101_com_iimatugai_2010-11-03_html_006,バンブー（bamboo）,ボンバー（bomber）,英単語の発音を正確に。,社長が電話で「竹だよ、竹、英語でボンバー！」と説明。bambooとbomberを混同。電話越しで伝わりにくかった。,True,www_1101_com_iimatugai_2010-11-03_html,N/A,社長,先方,日本語/英語,"['言い間違い', '聞き間違い', '英語', '非母語話者', 'ユーモア']","['電話', 'ビジネス', 'ノイズあり']"
www_1101_com_iimatugai_2010-11-03_html_007,お魚ですか、お肉ですか？,B、BEEF,質問の言語に注意しよう。,国際線の飛行機で日本人CAが日本語で質問しているのに、弟が思わず英語で「B、BEEF」と答えてしまった。,True,www_1101_com_iimatugai_2010-11-03_html,N/A,弟,CA,日本語/英語,"['言い間違い', '聞き間違い', '日本語', '英語', '非母語話者', 'ユーモア']","['飛行機', 'サービス業', '日常会話']"
