MishearID,Src,Tgt,Tips,Note,OriginalFlag,DocID,URL,SpeakerID,ListenerID,Language,Tags,Envs
www_1101_com_iimatugai_2011-11-09_001,May I help you?,Help me!,「May I help you?」は「お手伝いしましょうか？」の意味。助けてほしい時は「Help me!」や「Could you help me?」が適切。,アメリカのアパートで重いスーツケースを運ぶ際、タクシードライバーに助けを求めるつもりで「May I help you?」と言ってしまった。,True,www_1101_com_iimatugai_2011-11-09_html,N/A,不明,タクシードライバー,英語,"['言い間違い', '英語', '非母語話者', '生活', 'ユーモア']","['アメリカのアパート', '階段', 'タクシー乗り場', '英語', '日常会話', '騒音不明', 'マイク不明']"
www_1101_com_iimatugai_2011-11-09_002,キヨミズテンプル,キヨミズシュリンプ,「テンプル（寺）」と「シュリンプ（エビ）」は全く意味が異なる。寺の話をする時は「temple」を使う。,アメリカ人の夫に「清水寺」の話をしようとして「キヨミズシュリンプ」と言ってしまい、夫にからかわれた。,True,www_1101_com_iimatugai_2011-11-09_html,N/A,日本人妻,アメリカ人夫,英語/日本語,"['言い間違い', '英語', '非母語話者', '生活', 'ユーモア']","['アメリカの家庭', '日本人とアメリカ人', '英語', '日本語', '家庭内', '静か']"
www_1101_com_iimatugai_2011-11-09_003,ケルクショーズ（quelque chose）,契約書,フランス語の発音に慣れていないと日本語の単語に聞こえることがある。,フランス語レッスンで「ケルクショーズ」を「契約書」と聞き間違え、日本語を混ぜてくれているのかと思った。,True,www_1101_com_iimatugai_2011-11-09_html,N/A,先生,夫の同僚,フランス語,"['聞き間違い', 'フランス語', '非母語話者', '学習', 'ユーモア']","['フランス語グループレッスン', '教室', '複数人', 'フランス語', '日本語', '静か']"
www_1101_com_iimatugai_2011-11-09_004,アベックスシ？（avec ceci?）,アベック寿司？,「avec ceci?」は「他には？」の意味。寿司とは無関係。,フランス語レッスンのロールプレイで「アベックスシ？」を「アベック寿司？」と聞き間違え、「寿司は買いません」と答えてしまった。,True,www_1101_com_iimatugai_2011-11-09_html,N/A,先生,夫,フランス語,"['聞き間違い', 'フランス語', '非母語話者', '学習', 'ユーモア']","['フランス語グループレッスン', '教室', '複数人', 'フランス語', '日本語', '静か']"
www_1101_com_iimatugai_2011-11-09_005,フォルテ（強い）,ストロンツォ（糞ったれ）,「ストロンツォ」はイタリア語で侮辱語。「強い」は「フォルテ」。,イタリアのパーティーでハツカ大根の辛さを「ストロンツォ！」と言ってしまい、場が凍った。後で意味を知り赤面。,True,www_1101_com_iimatugai_2011-11-09_html,N/A,日本人,イタリア人家族,イタリア語,"['言い間違い', 'イタリア語', '非母語話者', '旅行', 'ユーモア']","['イタリアの家庭パーティー', 'ビュッフェ', 'イタリア語', '英語', '複数人', '賑やか']"
www_1101_com_iimatugai_2011-11-09_006,３９３９,"Thank you, Thank you","電話番号の「３９３９」を英語の「Thank you, Thank you」と言い間違えやすい。","アメリカのホテルに電話で予約確認後、会社の電話番号「３９３９」を「Thank you, Thank you」と言ってしまった。",True,www_1101_com_iimatugai_2011-11-09_html,N/A,日本人,ホテルスタッフ,英語,"['言い間違い', '英語', '非母語話者', '仕事', 'ユーモア']","['アメリカの旅行会社', '電話', '英語', 'オフィス', '静か']"
