MishearID,Src,Tgt,Tips,Note,OriginalFlag,DocID,URL,SpeakerID,ListenerID,Language,Tags,Envs
www_1101_com_iimatugai_archive_more090414_html_001,保健所だろ,モヘンジョダロ？,「保健所」は「ほけんじょ」、「モヘンジョダロ」は世界遺産の地名。音が似ている。,友人同士の会話で「母子手帳ってどこでもらうの？」の答え「保健所だろ」を新米ママが「モヘンジョダロ？」と聞き間違えた。,True,www_1101_com_iimatugai_archive_more090414_html,N/A,友人,新米ママ,日本語,"['聞き間違い', '日常', '家族', '友人']","['家庭', '食事中', '複数人会話', '生活音']"
www_1101_com_iimatugai_archive_more090414_html_002,そういえば、お前に言ってなかったっけ？,For everって、お前に言ってなかったっけ？,英語の「For ever」と日本語の「そういえば」は音が似ている。,彼氏との長電話中、「For everって、お前に言ってなかったっけ？」と聞こえたが、実際は「そういえば、お前に言ってなかったっけ？」だった。プロポーズと勘違いしてしまった。,True,www_1101_com_iimatugai_archive_more090414_html,N/A,彼氏,投稿者,日本語,"['聞き間違い', '日常', '恋愛', '電話']","['家庭', '電話', '夜', '静かな環境']"
www_1101_com_iimatugai_archive_more090414_html_003,ヒデキがノロになっちゃったよ,秀樹が五郎になっちゃったよ,「ノロ」と「五郎」は音が似ている。,職場で上司が「ヒデキがノロになっちゃったよ」と言ったのを「秀樹が五郎になっちゃったよ」と聞き間違えた。ヒデキ君がノロウィルスにかかった話だった。,True,www_1101_com_iimatugai_archive_more090414_html,N/A,上司,投稿者,日本語,"['聞き間違い', '職場', '日常']","['職場', '同僚との会話', '生活音']"
www_1101_com_iimatugai_archive_more090414_html_004,古着屋だよ,チュニジア？,「ふるぎや」と「チュニジア」は音が似ている。,部活の合宿で、先輩が「そのネグリジェ、どこで買ったの？」と聞かれ「古着屋だよ」と答えたが、聞いた方は「チュニジア？」と聞き間違えた。問答が2回繰り返された。,True,www_1101_com_iimatugai_archive_more090414_html,N/A,先輩,先輩,日本語,"['聞き間違い', '学校', '部活', '日常']","['学校', '合宿', '風呂上がり', '複数人会話', '生活音']"
www_1101_com_iimatugai_archive_more090414_html_005,クーピーで描いたら？,空気入れ替えたら？,「クーピー」と「空気」は音が似ている。,母が娘に「クーピーで描いたら？」と提案したところ、兄が「空気入れ替えたら？」と聞き間違えて窓を開けた。,True,www_1101_com_iimatugai_archive_more090414_html,N/A,母,兄,日本語,"['聞き間違い', '家族', '子ども', '日常']","['家庭', '午後', '雪', '親子の会話', '生活音']"
www_1101_com_iimatugai_archive_more090414_html_006,十代（teenager）,じゅうたん（carpet）,「じゅうだい」と「じゅうたん」は音が似ている。,CNNのニュースで「十代」と言っていたのを「じゅうたん」と聞き間違え、「じゅうたんになりすましてパーティに潜入」と勘違いした。実際は「25歳の犯人が17歳と偽った」話だった。,True,www_1101_com_iimatugai_archive_more090414_html,N/A,CNN,投稿者,日本語,"['聞き間違い', 'テレビ', 'ニュース', '英語', '非母語話者']","['家庭', 'テレビ視聴', 'CNN', 'ニュース', '生活音']"
www_1101_com_iimatugai_archive_more090414_html_007,home made chocolate,本命チョコ,英語の「home made」と日本語の「本命」は音が似ている。,"英会話教室で外国人講師が「Oh, home made chocolate!」と言ったのを「Oh、本命チョコ！」と聞き間違えた。日本語が少し話せる講師だったため、勘違いした。",True,www_1101_com_iimatugai_archive_more090414_html,N/A,外国人講師,投稿者,英語,"['聞き間違い', '英会話', 'バレンタイン', '非母語話者', '子ども', '教室']","['英会話教室', '小学生', 'バレンタイン', '生活音']"
