MishearID,Src,Tgt,Tips,Note,OriginalFlag,DocID,URL,SpeakerID,ListenerID,Language,Tags,Envs
www_1101_com_iimatugai_archive_more061225_001,バレイショ,バレエ衣装,カタカナ語は文脈で意味が変わるので注意。,高校の演劇部の友人が「バレイショを買いに行く」と言い、ジャガイモだと思ったが、実は「バレエ衣装」だった。友人同士、放課後の会話。,True,www_1101_com_iimatugai_archive_more061225,N/A,friend,投稿者,日本語,"['言いまつがい', '演劇部', 'カタカナ', '日常']","['学校', '友人同士', '静かな放課後']"
www_1101_com_iimatugai_archive_more061225_002,OS9（オーエスナイン）,OS無いんです,数字の「ナイン」と「無いん」を区別して発音する。,Macのサポート電話で「OS9（オーエスナイン）」と伝えたが、サポート担当者が「OS無いんです」と聞き間違えた。電話越し、ITサポートの会話。,True,www_1101_com_iimatugai_archive_more061225,N/A,投稿者,サポート,日本語,"['聞きまつがい', 'IT', '電話', '数字', '日常']","['電話', 'サポート', 'IT', 'オフィス']"
www_1101_com_iimatugai_archive_more061225_003,コンセンサス,五千円札,業界用語やカタカナ語ははっきり発音し、確認を怠らないこと。,会社の電話で「上層部同士でキッチリ五千円札をとっておいて」と聞こえたが、実際は「コンセンサスをとっておいて」だった。業界用語の聞き間違い。,True,www_1101_com_iimatugai_archive_more061225,N/A,先方,投稿者,日本語,"['聞きまつがい', '業界用語', '電話', 'ビジネス']","['会社', '電話', 'ビジネス会話', '静かなオフィス']"
www_1101_com_iimatugai_archive_more061225_004,セイン・カミュ,セイン・コスギ/ケイン・コスギ,タレント名は似ているので注意。カタカナ表記で確認を。,母がテレビの話をしていて「セイン・コスギ」と言ったが、実際は「セイン・カミュ」だった。母娘の家庭内会話、テレビの話題。,True,www_1101_com_iimatugai_archive_more061225,N/A,母,投稿者,日本語,"['名前', 'テレビ', '聞きまつがい', '家庭']","['家庭', 'リビング', 'テレビ']"
www_1101_com_iimatugai_archive_more061225_005,神田うのさん,勘三郎さん,有名人の名前は文脈で確認。漢字とカタカナの違いに注意。,結婚式場でドレスを見ていた際、係員が「神田うのさんのデザイン」と言ったのを「勘三郎さん」と聞き間違えた。式場見学、接客中の会話。,True,www_1101_com_iimatugai_archive_more061225,N/A,係員,投稿者,日本語,"['名前', '結婚式', '聞きまつがい', '有名人']","['結婚式場', '接客', '静かな会場']"
