MishearID,Src,Tgt,Tips,Note,OriginalFlag,DocID,URL,SpeakerID,ListenerID,Language,Tags,Envs
www_1101_com_iimatugai_2010-08-10_html_001,積み荷が散乱して,しめじが散乱して,「積み荷」と「しめじ」は音が似ている。文脈で判断しよう。,ラジオの交通情報を夫婦で聞いていた際、夫が「積み荷」を「しめじ」と聞き間違えた。きのこ類は滑りやすいという発想も影響。,True,www_1101_com_iimatugai_2010-08-10_html,N/A,夫,妻,日本語,"['言いまつがい', '聞き間違い', '日常', 'ユーモア']","['ラジオ放送', '家庭', 'リビング', 'スピーカー', '無雑音']"
www_1101_com_iimatugai_2010-08-10_html_002,バス停は禁煙です,バス停は人間です,「禁煙」と「人間」は音が似ている。アナウンスは聞き取りにくいことが多い。,バス車内アナウンスを乗客が聞き間違えた。意味が通らず再度聞き直して判明。,True,www_1101_com_iimatugai_2010-08-10_html,N/A,アナウンス,乗客,日本語,"['言いまつがい', '聞き間違い', '日常', 'ユーモア']","['バス車内', '公共交通機関', 'アナウンス', '走行音あり']"
www_1101_com_iimatugai_2010-08-10_html_003,豚バラチャーシュー麺,歌丸チャーシュー麺,「豚バラ」と「歌丸」は音が似ている。ラーメン屋のメニューに注意。,ラーメン屋で注文時、他の客の注文を聞き間違えた。落語家の名前と勘違い。,True,www_1101_com_iimatugai_2010-08-10_html,N/A,店員,客,日本語,"['言いまつがい', '聞き間違い', '日常', 'ユーモア']","['飲食店', 'ラーメン屋', '店内', '会話', '雑音あり']"
www_1101_com_iimatugai_2010-08-10_html_004,ガラスの仮面,習志野仮面,地名と有名漫画タイトルの聞き間違い。文脈で判断しよう。,職場で漫画の話題中、課長が「ガラスの仮面」を「習志野仮面」と聞き間違えた。課長の地元が習志野台。,True,www_1101_com_iimatugai_2010-08-10_html,N/A,部下,課長,日本語,"['言いまつがい', '聞き間違い', '日常', 'ユーモア']","['職場', 'オフィス', '会話', '静音']"
www_1101_com_iimatugai_2010-08-10_html_005,HUNTER×HUNTER休載ですか？,ハタハタ九千円ですか？,「ハンター」と「ハタハタ」、「休載」と「九千円」は音が似ている。,友人同士の会話で、漫画の話題が魚の値段に聞こえた。秋田県民でハタハタに親しみがあったことも影響。,True,www_1101_com_iimatugai_2010-08-10_html,N/A,友人,投稿者,日本語,"['言いまつがい', '聞き間違い', '日常', 'ユーモア']","['友人との会話', '自宅または学習環境', '会話', '静音']"
www_1101_com_iimatugai_2010-08-10_html_006,生理用品,製氷機,「生理用品」と「製氷機」は音が似ている。ホテルでは確認を。,ホテルのフロントで電話越しに「生理用品の販売場所」を尋ねたが「製氷機」と聞き間違えた。,True,www_1101_com_iimatugai_2010-08-10_html,N/A,"フロント男性, 女性スタッフ",投稿者,日本語,"['言いまつがい', '聞き間違い', '日常', 'ユーモア']","['ホテル', 'フロント', '電話', '静音']"
www_1101_com_iimatugai_2010-08-10_html_007,深野（ふかの）,不可能,人名と「不可能」は音が似ている。職場の固有名詞は注意。,取引先担当者名「深野」を「不可能」と聞き間違え、表に「不可能」と記載してしまった。,True,www_1101_com_iimatugai_2010-08-10_html,N/A,上司,投稿者,日本語,"['言いまつがい', '聞き間違い', '日常', 'ユーモア']","['職場', 'オフィス', '会話', '静音']"
www_1101_com_iimatugai_2010-08-10_html_008,シルク・ドゥ・ソレイユ,四六時中それを言う,外来語は日本語に聞き間違えやすい。文脈で判断しよう。,職場で「シルク・ドゥ・ソレイユ」の話題を「四六時中それを言う」と部長が聞き間違えた。,True,www_1101_com_iimatugai_2010-08-10_html,N/A,部長,投稿者,日本語,"['言いまつがい', '聞き間違い', '日常', 'ユーモア']","['職場', 'オフィス', '会話', '静音']"
