MishearID,Src,Tgt,Tips,Note,OriginalFlag,DocID,URL,SpeakerID,ListenerID,Language
coffee_break_parts_similar202002_001,カーディアックセーフティに関するスタディの現状ですが～,簡略セーフティに関するスタディの現状ですが～,医療用語やカタカナ語は特に注意して聞き取ること,医療・安全性に関する会議で、専門用語「カーディアック（心臓の）」が一般語「簡略」と聞き間違えられた。発話者は医療関係者。,True,coffee_break_parts_similar202002,,発話者A,速記者,ja
coffee_break_parts_similar202002_002,この法分野の対象の視野を限定してしまってはいけない～,この法分野の対象のシェアを限定してしまってはいけない～,漢語とカタカナ語の混同に注意,法律分野の議論で、「視野（しや）」が「シェア」と聞き間違えられた。発話者は法律関係者。,True,coffee_break_parts_similar202002,,発話者B,速記者,ja
coffee_break_parts_similar202002_003,ダイエットなんて、決意次第でできる問題～,ダイエットなんて、決意しないでできる問題～,語尾の音が似ている場合は文脈で判断,ダイエットに関する発言で、「次第（しだい）」が「しない」と聞き間違えられた。日常会話の中で発生。,True,coffee_break_parts_similar202002,,発話者C,速記者,ja
coffee_break_parts_similar202002_004,紛らわしくてあれですが、第３クォーターのクオータ（quota）の達成状況は～,紛らわしくてあれですが、第３クォーターのクォーター（quarter）の達成状況は～,カタカナ英語の意味・綴りの違いに注意,ビジネス会議で、「クオータ（quota）」が「クォーター（quarter）」と聞き間違えられた。両者は意味が異なる英語由来語。,True,coffee_break_parts_similar202002,,発話者D,速記者,ja
coffee_break_parts_similar202002_005,お尋ねの点ですが、それは一概には言えず、区々であり～,お尋ねの点ですが、それは一概には言えず、九九であり～,難読語や珍しい表現は特に注意して確認,説明の中で、難読語「区々（まちまち）」が一般的な「九九」と聞き間違えられた。発話者は説明者。,True,coffee_break_parts_similar202002,,発話者E,速記者,ja
