MishearID,Src,Tgt,Tips,Note,OriginalFlag,DocID,URL,SpeakerID,ListenerID,Language,Tags,Envs
coffee_break_parts_similar201207_001,岡山県の産業基盤は水島コンビナートで、石油精製能力は９％。エチレン生産能力、粗鋼生産能力を見ても、日本の生産の１割弱を占める地位を築いています。,岡山県の産業基盤は水島コンビナートで、石油精製能力は９％。一連の生産能力、粗鋼生産能力を見ても、日本の生産の１割弱を占める地位を築いています。,専門用語（化学用語）に注意。,会議での発言。専門用語「エチレン」が一般語「一連の」と聞き間違えられた。水島コンビナートの産業説明中。,True,coffee_break_parts_similar201207,N/A,不明,速記者,日本語,"['行政', '産業', '速記']",['文字起こし']
coffee_break_parts_similar201207_002,高速ツアーバス事故の処分関係ですが、昨日の聴聞で、ハーヴェストが処分理由に当たらないとして異議を述べましたが、これについての受け止めと、今後の見通しについて～,高速ツアーバス事故の処分関係ですが、昨日の朝刊で、ハーヴェストが処分理由に当たらないとして異議を述べましたが、これについての受け止めと、今後の見通しについて～,会議や審査の用語と報道用語の混同に注意。,行政会見での発言。「聴聞で」（ヒアリングの場）が「朝刊で」（新聞）と聞き間違えられた。,True,coffee_break_parts_similar201207,N/A,不明,速記者,日本語,"['行政', '交通', '速記']",['文字起こし']
coffee_break_parts_similar201207_003,この後の参考資料のほうですが、既に２月にご説明させていただいておりますが～,この後の参考資料のほうですが、既に２月に補正済みさせていただいておりますが～,動詞の聞き間違いに注意。,会議資料説明時の発言。「ご説明」（説明した）が「補正済み」（修正済み）と聞き間違えられた。,True,coffee_break_parts_similar201207,N/A,不明,速記者,日本語,"['ビジネス', '会議', '速記']",['文字起こし']
coffee_break_parts_similar201207_004,大変緻密な分析をしておられるので、大ざっぱな聞き方で恐縮ですが、この自治体の人口規模等はどういう環境でしょうか。,大変緻密な分析をしておられるので、大ざっぱな形で恐縮ですが、この自治体の人口規模等はどういう環境でしょうか。,質問表現のバリエーションに注意。,インタビュー中の発言。「聞き方で」（質問の仕方）が「形で」と聞き間違えられた。,True,coffee_break_parts_similar201207,N/A,不明,速記者,日本語,"['行政', 'インタビュー', '速記']",['文字起こし']
coffee_break_parts_similar201207_005,東日本大震災から１年余、被災地では復旧から復興へと軸足は移りつつありますが、地域経済が厳しい状況にあることには変わりなく、地銀の役割は高まっており、地銀界として取り組む課題は山積し～,東日本大震災から１年余、被災地では復旧から復興へと軸足は移りつつありますが、地域経済が厳しい状況にあることには変わりなく、地銀の役割は高まっており、地銀間として取り組む課題は山積し～,業界用語の末尾の違いに注意。,金融業界の会議。「地銀界」（業界全体）が「地銀間」（銀行間）と聞き間違えられた。,True,coffee_break_parts_similar201207,N/A,不明,速記者,日本語,"['金融', '震災', '速記']",['文字起こし']
coffee_break_parts_similar201207_006,平成２０年１１月、香港支店の取引先等を回って、視察も兼ねてインドのムンバイのホテルに入った７分後、外国人を無差別に狙った同時テロに遭遇し、私の人生観は～,平成２０年１１月、香港支店の取引先等もあって、視察も兼ねてインドのムンバイのホテルに入った７分後、外国人を無差別に狙った同時テロに遭遇し、私の人生観は～,助詞の違いに注意。,体験談の発言。「を回って」（訪問して）が「もあって」と聞き間違えられた。,True,coffee_break_parts_similar201207,N/A,不明,速記者,日本語,"['ビジネス', '体験談', '速記']",['文字起こし']
coffee_break_parts_similar201207_007,来年３月で金融円滑化法が打ち切りになりますが、地域への円滑な資金供給は地方銀行にとって、いわば使命といいますか、従来からいろんな形で取り組んでおり、円滑化法の有無で基本的に構造が変わることはない。,来年３月で金融円滑化法が打ち切りになりますが、地域への円滑な資金供給は地方銀行にとって、いわば収益といいますか、従来からいろんな形で取り組んでおり、円滑化法の有無で基本的に構造が変わることはない。,意味が大きく異なる単語の聞き間違いに注意。,金融政策に関する発言。「使命」（ミッション）が「収益」（利益）と聞き間違えられた。,True,coffee_break_parts_similar201207,N/A,不明,速記者,日本語,"['金融', '政策', '速記']",['文字起こし']
coffee_break_parts_similar201207_008,政府からは、法の延長を踏まえて政策パッケージが出されていますが、金融機関だけではなく、地公体、支援協議会等の関係者、官民一体となった取り組み……。,政府からは、法の延長を踏まえて政策パッケージが出されていますが、金融機関だけではなく、地方体、支援協議会等の関係者、官民一体となった取り組み……。,行政用語の略語に注意。,政策説明の発言。「地公体」（地方公共団体）が「地方体」と聞き間違えられた。,True,coffee_break_parts_similar201207,N/A,不明,速記者,日本語,"['行政', '政策', '速記']",['文字起こし']
coffee_break_parts_similar201207_009,取り組むべき課題は、地域経済の再生・活性化、新制度、諸規制への対応、安心・安全な取引確保に向けた仕組みづくりの３点。中長期的には社会経済構造の変化に対応し～,取り組むべき課題は、地域経済の再生、活性化、新制度、諸規制への対応、安心、安全な取引確保に向けた仕組みづくりの３点。中長期的には世界経済構造の変化に対応し～,グローバルとローカルの用語の違いに注意。,経済政策の説明。「社会経済構造」（社会全体の経済構造）が「世界経済構造」（グローバル経済構造）と聞き間違えられた。,True,coffee_break_parts_similar201207,N/A,不明,速記者,日本語,"['経済', '政策', '速記']",['文字起こし']
