MishearID,Src,Tgt,Tips,Note,OriginalFlag,DocID,URL,SpeakerID,ListenerID,Language
coffee_break_parts_similar201907_001,未熟者ですが、一朝事あれば、死に物狂いで～,未熟者ですが、一応断れば、死に物狂いで～,「一朝事あれば」と「一応断れば」は音が似ているため注意。,会議やインタビューの発話中、速記者が文脈を誤認した可能性。発話者は自分の覚悟を述べている場面。,True,coffee_break_parts_similar201907,,unknown,速記者,ja
coffee_break_parts_similar201907_002,健康面はどうでしょうか、喫煙なんかで肺が煤けていませんか～,健康面はどうでしょうか、喫煙なんかで排ガス付けていませんか～,「肺が煤けて」と「排ガス付けて」は発音が似ている。,健康に関する話題で、専門用語や発音の類似性による誤認。喫煙の害について話している場面。,True,coffee_break_parts_similar201907,,unknown,速記者,ja
coffee_break_parts_similar201907_003,最新の教材と対となる指導法をどう考えるか～,最新の教材とツイートのある指導法をどう考えるか～,「対となる」と「ツイートのある」は音の連なりが似ている。,教材や指導法の話題で、音の連なりが似ていたため誤認。教育現場での発話。,True,coffee_break_parts_similar201907,,unknown,速記者,ja
coffee_break_parts_similar201907_004,それ、大事なんだからしっかりとwrittenで記録に残しておかないと～,それ、大事なんだからしっかり取り組んで記録に残しておかないと～,英語混じり表現は日本語に置き換わりやすいので注意。,英語混じりの表現が日本語に置き換わった。記録の重要性を強調する場面。,True,coffee_break_parts_similar201907,,unknown,速記者,ja
coffee_break_parts_similar201907_005,そのこと自体は当方としては推奨いたしかねますが～,そのこと自体は当方としては追従いたしかねますが～,「推奨」と「追従」は語感が近いので注意。,ビジネスや行政文脈で、語感の近さによる誤認。発話者が方針を述べている場面。,True,coffee_break_parts_similar201907,,unknown,速記者,ja
