MishearID,Src,Tgt,Tips,Note,OriginalFlag,DocID,URL,SpeakerID,ListenerID,Language,Tags,Envs
coffee_break_parts_similar201912_001,日本初の官許の人体解剖というのは江戸時代～,日本初の歓喜の人体解剖というのは江戸時代～,歴史用語や漢字語は文脈で再確認を。,歴史的な発表の場で、専門用語「官許（かんきょ）」が「歓喜（かんき）」と聞き間違えられた。漢字の読みが同じで意味が全く異なるため、文脈確認が重要。,True,coffee_break_parts_similar201912,N/A,不明,速記者,日本語,"['学術', '歴史', '速記', '聞き間違い', 'ビジネス', '行政', '学術', 'カタカナ語', '専門用語']",['文字起こし']
coffee_break_parts_similar201912_002,私もはっきり言って100％アグリーな気持ちであります、同意であります～,私もはっきり言って100％あんぐりな気持ちであります、同意であります～,カタカナ英語は発音に注意。,ビジネス会議で「アグリー（agree）」が「あんぐり」と聞き間違えられた。カタカナ語と日本語の音の近さが原因。,True,coffee_break_parts_similar201912,N/A,不明,速記者,日本語,"['ビジネス', 'カタカナ語', '速記', '聞き間違い', '行政', '学術', '専門用語']",['文字起こし']
coffee_break_parts_similar201912_003,コンソーシアムの申請、初期エクイティのこと～,コンソーシアムの申請、所定区域のこと～,専門用語は事前にリスト化を。,ビジネス用語「初期エクイティ」が「所定区域」と聞き間違えられた。カタカナ語と漢字語の音の類似が原因。,True,coffee_break_parts_similar201912,N/A,不明,速記者,日本語,"['ビジネス', '専門用語', '速記', '聞き間違い', '行政', '学術', 'カタカナ語']",['文字起こし']
coffee_break_parts_similar201912_004,強風に圧流をされてしまった船が～,強風にはつりをされてしまった船が～,専門用語の確認を徹底。,船舶事故の説明で「圧流（あつりゅう）」が「はつり」と聞き間違えられた。専門用語の認知度不足が原因。,True,coffee_break_parts_similar201912,N/A,不明,速記者,日本語,"['学術', '専門用語', '速記', '聞き間違い', 'ビジネス', '行政', 'カタカナ語']",['文字起こし']
coffee_break_parts_similar201912_005,企業経営のみならず地域行政にとっても有用なものに～,企業経営のみならず地域要請にとっても有用なものに～,漢字語の音の近さに注意。,行政関連の発言で「行政（ぎょうせい）」が「要請（ようせい）」と聞き間違えられた。漢字語の音の近さが原因。,True,coffee_break_parts_similar201912,N/A,不明,速記者,日本語,"['行政', '漢字語', '速記', '聞き間違い', 'ビジネス', '学術', 'カタカナ語', '専門用語']",['文字起こし']
