MishearID,Src,Tgt,Tips,Note,OriginalFlag,DocID,URL,SpeakerID,ListenerID,Language,Tags,Envs
coffee_break_parts_similar202309_001,津波発生の際に素早く、スマートに樋門を閉める～,津波発生の際に素早く、スマートにひもを締める～,「樋門」と「ひも」は音が似ているため注意。,災害対策会議などでの発言。専門用語「樋門（ひもん）」が一般語「ひも」と混同された。速記者が音だけで判断したため発生。,True,coffee_break_parts_similar202309,N/A,不明,速記者,日本語,"['災害対策', '行政', '速記']",['文字起こし']
coffee_break_parts_similar202309_002,機運の醸成の持続、その要諦は～,機運の醸成の持続、その要点は～,「要諦」と「要点」は意味も近く、音も似ている。,ビジネスや行政の会議での発言。難読語「要諦（ようてい）」が一般語「要点」と聞き間違えられた。,True,coffee_break_parts_similar202309,N/A,不明,速記者,日本語,"['ビジネス', '行政', '速記']",['文字起こし']
coffee_break_parts_similar202309_003,こういったものが二元的にとどまらず、多元的な～,こういったものが人間的にとどまらず、多元的な～,「二元」と「人間」は音が似ているため注意。,議論の文脈で「二元的（にげんてき）」が「人間的（にんげんてき）」と聞き間違えられた。速記者が文脈を誤解した可能性。,True,coffee_break_parts_similar202309,N/A,不明,速記者,日本語,"['ビジネス', '行政', '速記']",['文字起こし']
coffee_break_parts_similar202309_004,以前は分納で行われてはきていたんですが～,以前は分捕りで行われてはきていたんですが～,「分納」と「分捕り」は発音が似ている。,過去の運用方法に関する説明。「分納（ぶんのう）」が「分捕り（ぶんどり）」と聞き間違えられた。文脈から判断が必要。,True,coffee_break_parts_similar202309,N/A,不明,速記者,日本語,"['行政', '速記']",['文字起こし']
coffee_break_parts_similar202309_005,定量的に評価する際の恣意性の排除の配慮について～,定量的に評価する際の申請の排除の配慮について～,「恣意性」と「申請」は音が似ているため注意。,評価基準の説明。「恣意性（しいせい）」が「申請（しんせい）」と聞き間違えられた。専門用語の認識不足が原因。,True,coffee_break_parts_similar202309,N/A,不明,速記者,日本語,"['ビジネス', '行政', '速記']",['文字起こし']
