MishearID,Src,Tgt,Tips,Note,OriginalFlag,DocID,URL,SpeakerID,ListenerID,Language
coffee_break_parts_similar201412_001,現地法人の工場での生産品質をより上質のものにするために何度も現地に足を運び、工場に詳細図を全部支給して、いろいろなものを全部織り込んで～,現地法人の工場での生産品質をより上質のものにするために何度も現地に足を運び、工場に小サイズを全部支給して、いろいろなものを全部織り込んで～,「しょうさいず」と「しょうさいず」の音が似ているため注意。,工場への支給物に関する会議発言。専門用語「詳細図」と一般語「小サイズ」の音が似ており、速記者が聞き間違えた。,True,coffee_break_parts_similar201412,,不明,速記者,ja
coffee_break_parts_similar201412_002,本審議会の会長には、これまで会長をお務めいただいており、専門家として、豊富な経験と卓越した識見をお持ちであり～,本審議会の会長には、これまで会長をお務めいただいており、専門家として、豊富な経験と卓越した執権をお持ちであり～,「しきけん」と「しっけん」の発音の違いに注意。,審議会会長の資質を述べる場面で、専門用語「識見」と法的用語「執権」を混同。発音が似ているため発生。,True,coffee_break_parts_similar201412,,不明,速記者,ja
coffee_break_parts_similar201412_003,大学がつくる子会社である以上、大学の理念に基づく経営を実行していただきたい、つまり、お互いに牽制の機能を持ってもらいたいというのが～,大学がつくる子会社である以上、大学の理念に基づく経営を実行していただきたい、つまり、お互いに形成の規模を持ってもらいたいというのが～,「けんせいのきのう」と「けいせいのきぼ」の音の違いに注意。,大学子会社の経営に関する発言。抽象的な表現で、速記者が意味を取り違えた可能性。,True,coffee_break_parts_similar201412,,不明,速記者,ja
coffee_break_parts_similar201412_004,瑕疵責任や個人情報の問題も縦割りになりがちですが、一時期、道路特会をやったときに、地下鉄や臨港道路の支援とかやったのですけれども～,瑕疵責任や個人情報の問題も縦割りになりがちですが、一時期、道路とっかえをやったときに、地下鉄や臨港道路の支援とかやったのですけれども～,「とっかい」と「とっかえ」の聞き間違いに注意。,道路関連の特別会計（特会）に関する行政会議での発言。専門用語が一般語に聞き間違えられた。,True,coffee_break_parts_similar201412,,不明,速記者,ja
coffee_break_parts_similar201412_005,時機に後れた攻撃防御方法という問題はありますが、比較的、日本の裁判所はそういうことに捉われるよりは、メタ紛争とでも言いましょうか～,時機に後れた攻撃防御方法という問題はありますが、比較的、日本の裁判所はそういうことに捉われるよりは、べた紛争とでも言いましょうか～,「メタ」と「べた」の発音の違いに注意。,裁判所の紛争分類に関する発言。カタカナ語「メタ」と「べた」の聞き間違い。,True,coffee_break_parts_similar201412,,不明,速記者,ja
coffee_break_parts_similar201412_006,詳細な事実関係は承知しておりませんが、個別のこうした事案が公職選挙法の禁じた寄付行為に該当するか否かというのは～,詳細な事実関係は承知しておりませんが、個別のこうした事案が公職選挙法の禁じた給付行為に該当するか否かというのは～,「きふ」と「きゅうふ」の発音の違いに注意。,公職選挙法に関する発言。法的用語「寄付」と「給付」の混同。,True,coffee_break_parts_similar201412,,不明,速記者,ja
coffee_break_parts_similar201412_007,米ドル特則についても、ファンド総額は１０億ドル超に達しておりますし、ＡＢＬ特則についても、今、行内ファンドを設定して積極的に取り組んでいるところでございます。,米ドル特則についても、ファンド総額は１０億ドル超に達しておりますし、ＡＢＬ特則についても、今、国内ファンドを設定して積極的に取り組んでいるところでございます。,「こうない」と「こくない」の発音の違いに注意。,ファンドの種類に関する金融会議での発言。銀行内（行内）ファンドと国内ファンドの混同。,True,coffee_break_parts_similar201412,,不明,速記者,ja
