MishearID,Src,Tgt,Tips,Note,OriginalFlag,DocID,URL,SpeakerID,ListenerID,Language,Tags,Envs
coffee_break_parts_similar201204_001,地方の各地域で政治スクールとか政治塾というのがあるが、座学だけじゃなくて、実践のレベルも上げていくプログラムもやったほうがいい。,地方の各地域で政治スクールとか政治部というのがあるが、大学だけじゃなくて、実践のレベルも上げていくプログラムもやったほうがいい。,「政治塾」と「政治部」、「座学」と「大学」は音が似ているため注意。,地方行政や教育分野の会議での発言。速記者が「塾」と「部」、「座学」と「大学」を聞き間違えた。,True,coffee_break_parts_similar201204,N/A,不明,速記者,日本語,"['行政', '教育', '速記']",['文字起こし']
coffee_break_parts_similar201204_002,我々のこれまで公表している物価安定の理解について、もし誤解があるとすれば、それを払拭することを通じて当然それなりの効果、影響は出てくると思いますが……。,我々のこれまで公表している物価安定の理解について、もし誤解があるとすれば、そういう不祥事を通じて当然それなりの効果、影響は出てくると思いますが……。,「払拭すること」と「不祥事」は意味が大きく異なるので要注意。,金融政策に関する会議での発言。速記者が「払拭すること」を「不祥事」と聞き間違えた。,True,coffee_break_parts_similar201204,N/A,不明,速記者,日本語,"['金融', '速記']",['文字起こし']
coffee_break_parts_similar201204_003,今後の出口戦略・金融政策の変更等については、見方が変わってきたのか、基本的には、極めて緩和的な金融環境を続けるという表現をしているが～,今後の出口戦略・金融政策の変更等については、見方が変わってきたのか、基本的には、機を見て緩和的な金融環境を続けるという表現をされているが～,「極めて」と「機を見て」は音が似ているが意味が異なる。,金融政策に関する会議での発言。速記者が「極めて」を「機を見て」と聞き間違えた。,True,coffee_break_parts_similar201204,N/A,不明,速記者,日本語,"['金融', '速記']",['文字起こし']
coffee_break_parts_similar201204_004,インフルエンザ等、児童・生徒、あるいは教員の健康への影響等を考えていかなければならない。,インフルエンザ等、児童・生徒、あるいは町民の健康への影響等を考えていかなければならない。,「教員」と「町民」は語感が異なるので注意。,教育現場や行政会議での発言。速記者が「教員」を「町民」と聞き間違えた。,True,coffee_break_parts_similar201204,N/A,不明,速記者,日本語,"['教育', '行政', '速記']",['文字起こし']
coffee_break_parts_similar201204_005,どこから水があふれたのかチェックしろという明確な指示が出たのは、多分この１年ぐらいです。,どこから水があふれたのかチェックしろというメーカーから指示が出たのは、多分この１年ぐらいです。,「明確な指示」と「メーカーから指示」は意味が異なるので注意。,行政やインフラ管理の会議での発言。速記者が「明確な指示」を「メーカーから指示」と聞き間違えた。,True,coffee_break_parts_similar201204,N/A,不明,速記者,日本語,"['行政', '速記']",['文字起こし']
coffee_break_parts_similar201204_006,国の将来像を考えて、社会保障や教育への財政支出を大きくしたい。そういう希望に向けて、税収、埋蔵金をどうするか、考えなければいけない。,国の将来像を考えて、社会保障や教育への財政支出を大きくしたい。そういう規模に向けて、税収、埋蔵金をどうするか、考えなければいけない。,「希望」と「規模」は音が似ているが意味が異なる。,政策や財政に関する会議での発言。速記者が「希望」を「規模」と聞き間違えた。,True,coffee_break_parts_similar201204,N/A,不明,速記者,日本語,"['行政', '速記']",['文字起こし']
coffee_break_parts_similar201204_007,金融円滑化をベースにして、実抜計画というか、再建計画をちゃんとつくったところは下へ落とさないという運用ルールがある。,金融円滑化をベースにして、実罰計画というか、再建計画をちゃんとつくったところは下へ落とさないという運用ルールがある。,「実抜計画」と「実罰計画」は音が似ているが意味が異なる。,金融や再建計画に関する会議での発言。速記者が「実抜計画」を「実罰計画」と聞き間違えた。,True,coffee_break_parts_similar201204,N/A,不明,速記者,日本語,"['金融', '速記']",['文字起こし']
coffee_break_parts_similar201204_008,日本語教員養成のカリキュラム・シラバスの編成について、その特徴、個別性ばかりに注目するというのではなく、共通する理念、キーワードがあるかどうかを見ることも大事である。,日本語教員養成のカリキュラム・シラバスの編成について、その特徴、個別性、わかる意味に注目するというのではなく、共通する理念、キーワードがあるかどうかを見ることも大事である。,「個別性ばかりに注目する」と「個別性、わかる意味に注目する」は意味が異なる。,教育分野の会議での発言。速記者が「個別性ばかりに注目する」を「個別性、わかる意味に注目する」と聞き間違えた。,True,coffee_break_parts_similar201204,N/A,不明,速記者,日本語,"['教育', '速記']",['文字起こし']
