MishearID,Src,Tgt,Tips,Note,OriginalFlag,DocID,URL,SpeakerID,ListenerID,Language
coffee_break_parts_similar202005_001,例の実験、供試体等のお話のことですが～,例の実験、今日したいとのお話のことですが～,専門用語は文脈で再確認すること,会議中、実験に関する話題で「供試体等（きょうしたいとう）」が「今日したいと」に聞き間違えられた。専門用語が日常語に誤変換された事例。,True,coffee_break_parts_similar202005,,不明,速記者,ja
coffee_break_parts_similar202005_002,今それを言っちゃうと、すぐにフィードバックがかかってまずい～,今それを言っちゃうと、すぐにフィールドワークが変わってまずい～,カタカナ語の類似音に注意,会議中の議論で「フィードバックがかかって」が「フィールドワークが変わって」に聞き間違えられた。カタカナ語の音の類似による誤認。,True,coffee_break_parts_similar202005,,不明,速記者,ja
coffee_break_parts_similar202005_003,野菜もたくさんできるので、地域の人やハイカーの人たちにも～,野菜もたくさんできるので、地域の人や配下の人たちにも～,外来語と漢字語の区別に注意,地域活動の話題で「ハイカー」が「配下」に聞き間違えられた。外来語と漢字語の音の類似による誤認。,True,coffee_break_parts_similar202005,,不明,速記者,ja
coffee_break_parts_similar202005_004,こういうご時世なんで、謙抑的な予算編成に～,こういうご時世なんで、禁欲的な予算編成に～,漢字語の意味と音の違いに注意,予算編成の方針説明で「謙抑的な」が「禁欲的な」に聞き間違えられた。漢字語の類似による誤認。,True,coffee_break_parts_similar202005,,不明,速記者,ja
coffee_break_parts_similar202005_005,データ、統計を扱う上で、所在源がわかるように～,データ、統計を扱う上で、諸財源がわかるように～,専門用語の正確な聞き取りを心がける,統計・データ管理の話題で「所在源」が「諸財源」に聞き間違えられた。専門用語の聞き取りミス。,True,coffee_break_parts_similar202005,,不明,速記者,ja
